,Name,Categories,Description,Tag,FirstDetected,LastDetected,IsPremium,Link,Parent
0,Google Analytics with Ad Tracking,['Advertiser Tracking'],"Google Analytics collects the information it normally does, as well as the DoubleClick cookie when that cookie is present in relation to display advertising tracking.",analytics,1387494000000,1594422000000,no,https://support.google.com/analytics/answer/2444872,
1,CloudFront,,"Amazon CloudFront is a web service for content delivery. It integrates with other Amazon Web Services to give developers and businesses an easy way to distribute content to end users with low latency, high data transfer speeds, and no commitments.",cdn,1387494000000,1634626800000,no,http://aws.amazon.com/cloudfront/,
2,CrazyEgg,['Site Optimization'],Crazy Egg provides visualization of visits to your website.,analytics,1387494000000,1575327600000,maybe,http://crazyegg.com/,
3,Apache 2.2,,Apache version 2.2.*,Web Server,1385679600000,1594422000000,no,http://httpd.apache.org/docs/2.2,Apache
4,jQuery 1.7.1,,jQuery version 1.7.1,javascript,1385679600000,1437536334862,no,http://blog.jquery.com/2011/11/21/jquery-1-7-1-released/,jQuery
5,Facebook Domain Insights,['Social Management'],This website contains tracking information that allows admins to see Facebook Insights out of Facebook to this domain.,analytics,1379286000000,1636268400000,no,http://www.facebook.com/insights/,
6,Shockwave Flash Embed,,Adobe Flash Macromedia shockwave content. End of life product retiring in 2020.,framework,1006848000000,1587855600000,no,http://www.macromedia.com/software/flash/about/,
7,YouTube IFrame Upload,,Lets users upload videos to YouTube from any webpage.,widgets,1379286000000,1636268400000,no,http://developers.google.com/youtube/youtube_upload_widget,
8,Twitter Tweet Button,,Official Tweet Button for sharing articles on websites and counting how many times a URL has been shared.,widgets,1379286000000,1518735600000,no,https://twitter.com/about/resources/buttons#tweet,
9,Facebook Send Button,,The Send Button allows users to easily send content to their friends.,widgets,1379286000000,1379286000000,no,http://developers.facebook.com/docs/reference/plugins/send/,
10,jQuery Once,['jQuery Plugin'],Filters out all elements that had the same filter applied on them before. ,javascript,1379631600000,1636268400000,no,http://plugins.jquery.com/once/,jQuery
11,Mandrill,['Transactional Email'],Mandrill is an email infrastructure service. Detailed analytics offer insight to measure email performance.,mx,1378422000000,1633244400000,yes,http://mandrill.com/,
12,Amazon Route 53,['Enterprise DNS'],Amazon's scalable DNS web service system.,ns,1376607600000,1636268400000,no,http://aws.amazon.com/route53/,
13,Hover Intent,['UI'],"hoverIntent is a plug-in that attempts to determine the user's intent. It works like (and was derived from) jQuery's built-in hover. However, instead of immediately calling the onMouseOver function, it waits until the user's mouse slows down enough before making the call.",javascript,1376002800000,1636268400000,no,http://cherne.net/brian/resources/jquery.hoverIntent.html,
14,jQuery Cookie,['jQuery Plugin'],"A simple, lightweight jQuery plugin for reading, writing and deleting cookies.",javascript,1376002800000,1636268400000,no,https://github.com/carhartl/jquery-cookie,jQuery
15,Amazon,"['Cloud Hosting', 'Cloud PaaS']",This site is hosted on Amazon AWS EC2 Infrastructure.,hosting,1376002800000,1636268400000,no,http://aws.amazon.com,
16,Google Font API,['Fonts'],The Google Font API helps you add web fonts to any web page.,widgets,1376002800000,1634886000000,no,https://fonts.google.com,
17,jQuery Form,['jQuery Plugin'],jQuery Form Plugin allows you to easily and unobtrusively upgrade HTML forms to use AJAX.,javascript,1376002800000,1636268400000,no,http://jquery.malsup.com/form/,jQuery
18,html5shiv,['Compatibility'],HTML5 IE enabling script shim.,javascript,1376002800000,1633244400000,no,https://github.com/afarkas/html5shiv,
19,Apache,,Apache has been the most popular web server on the Internet since April 1996.,Web Server,1376002800000,1636268400000,no,http://httpd.apache.org/,
20,Varnish,,Varnish is a web accelerator / reverse proxy caching server.,Web Server,1376002800000,1636268400000,no,http://varnish-software.com/,
21,StartSSL,['Root Authority'],Certificate provided by StartSSL.,ssl,1372806000000,1401321600000,no,http://startssl.com,
22,Cloudflare DNS,,DNS services provided by Cloudflare.,ns,1359673200000,1376002800000,no,http://cloudflare.com,
23,GStatic Google Static Content,,Google has off-loaded static content (Javascript/Images/CSS) to a different domain name in an effort to reduce bandwidth usage and increase network performance for the end user.,cdn,1367157600000,1636268400000,no,https://google.com,
24,Twitter Timeline,,"Add your tweets, favourites or searches as a timeline to the website.",widgets,1364302800000,1594422000000,no,http://twitter.com/settings/widgets,
25,Optimizely,"['A/B Testing', 'Site Optimization', 'Conversion Optimization', 'Personalization']",Optimizely empowers companies to deliver more relevant and effective digital experiences on websites and mobile through A/B testing and personalization.,analytics,1363698000000,1632294000000,yes,http://www.optimizely.com,
26,Google Plus One Button,,Google+ +1 Button implementation.,widgets,1362056400000,1381705200000,no,https://developers.google.com/+/plugins/+1button/,
27,Google Plus One Platform,,Google+ API functionality.,widgets,1362056400000,1523228400000,no,https://developers.google.com/+/,
28,Akamai,,Akamai provides a distributed computing platform for global Internet content and application delivery.,cdn,1355490000000,1473202800000,no,http://akamai.com,
29,Facebook CDN,,This page has content that links to the Facebook content delivery network.,cdn,1355490000000,1633244400000,no,http://www.facebook.com,
30,Twitter CDN,,"This page contains content sourced from the Twitter CDN, either by the use of Widgets or linking to image content on twimg.com currently hosted by Akamai and Amazon.",cdn,1355490000000,1636268400000,no,http://twitter.com,
31,jQuery Validate,['jQuery Plugin'],JQuery Form Validation Plugin.,javascript,1343570400000,1633244400000,no,http://jqueryvalidation.org,jQuery
32,AJAX Libraries API,,"The AJAX Libraries API is a content distribution network and loading architecture for the most popular, open source JavaScript libraries.",cdn,1324213200000,1636268400000,no,http://code.google.com/apis/ajaxlibs/documentation/,
33,jQuery Cycle,['jQuery Plugin'],A slideshow plugin for JQuery that supports many different types of transition effects.,javascript,1343570400000,1633244400000,no,http://jquery.malsup.com/cycle/,jQuery
34,Twitter Platform,,The page embeds the Twitter platform in one method or another.,javascript,1355490000000,1633244400000,no,http://twitter.com/about/resources,
35,Twitter Follow Button,,Follow Button to your website to increase engagement and create a lasting connection with your audience.,widgets,1356958800000,1551567600000,no,https://twitter.com/about/resources/buttons#follow,
36,jQuery Colorbox,['jQuery Plugin'],"A light-weight, customizable lightbox plugin for jQuery.",javascript,1343570400000,1636268400000,no,http://colorpowered.com/colorbox/,jQuery
37,Shadowbox,,Shadowbox is an online media viewer application that supports all of the web's most popular media publishing formats. ,javascript,1324213200000,1479855600000,no,http://www.shadowbox-js.com,
38,Facebook Like Button,,The code to implement a Facebook Like Button on the page.,widgets,1351774800000,1518735600000,no,http://developers.facebook.com/docs/reference/plugins/like/,
39,Drupal,['Open Source'],An engine suitable to setup or build a content driven or community driven website. Modular design allows flexibility in design.,cms,1343570400000,1636268400000,no,http://www.drupal.org,
40,RSS,,"A family of web feed formats used to publish frequently updated content such as blog entries, news headlines or podcasts.",feeds,1324213200000,1636268400000,no,http://en.wikipedia.org/wiki/RSS_(file_format),
41,jQuery,['JavaScript Library'],"JQuery is a fast, concise, JavaScript Library that simplifies how you traverse HTML documents, handle events, perform animations, and add Ajax interactions to your web pages. jQuery is designed to change the way that you write JavaScript.",javascript,1324213200000,1636268400000,no,http://jquery.com,jQuery
42,MailChimp,['Feedback Forms and Surveys'],MailChimp is a widely used Mailng List delivery and support service.,widgets,1346940000000,1551567600000,maybe,http://www.mailchimp.com,
43,Content Delivery Network,,This page contains links that give the impression that some of the site contents are stored on a content delivery network.,CDN,1255417200000,1636268400000,no,http://en.wikipedia.org/wiki/Content_Delivery_Network,
44,WidgetBox,,The website contains custom widgets from Widgetbox.com. Some of them may be listed along side this entry.,widgets,1346940000000,1381705200000,no,http://widgetbox.com,
45,nginx,,nginx [engine x] is a HTTP server and mail proxy server written by Igor Sysoev.,Web Server,1346940000000,1633158000000,no,http://nginx.net/,
46,PHP,,PHP is a widely used general-purpose scripting language that is especially suited for Web development and can be embedded into HTML.,framework,1324213200000,1633158000000,no,http://www.php.net,
47,cufón,,sIFR replacement cufon with simpler and easier to use functionality. Shows fonts in a nice format.,javascript,1320584400000,1381705200000,no,http://wiki.github.com/sorccu/cufon/about,
48,DoubleClick.Net,,"DoubleClick enables agencies, marketers and publishers to work together successfully and profit from their digital marketing investments.",ads,1320584400000,1632294000000,no,http://www.doubleclick.com,
49,DoubleClick Floodlight,,Floodlight is feature of DoubleClick ads that allows advertisers to capture and report on the actions of users who visit their website after viewing or clicking on one of the advertiser's ads.,analytics,1320584400000,1587855600000,no,http://www.google.com/support/dfa/partner/bin/static.py?page=guide.cs&guide=28818,
50,Facebook for Websites,,Allows a user to make a website more sociable and connected with integrations from the hugely popular Facebook website.,javascript,1320584400000,1636268400000,no,http://developers.facebook.com/,
51,Facebook SDK,," JavaScript SDK enables you to access all of the features of the Graph API via JavaScript, and it provides a rich set of client-side functionality for authentication and sharing. It differs from Facebook Connect.",javascript,1320584400000,1636268400000,no,http://developers.facebook.com/docs/reference/javascript/,
52,YouTube,"['Live Stream / Webcast', 'Online Video Platform', 'Social Video Platform']",Embedded videos from YouTube.,media,1234080000000,1634367600000,no,http://youtube.com,
53,Facebook Like,['Social Sharing'],"Allows users to Like items they find on the web, similar to how you Like items within Facebook.",widgets,1320584400000,1518735600000,no,http://developers.facebook.com/docs/reference/plugins/like,
54,JCarousel Lite,"['jQuery Plugin', 'Slider']",jCarousel Lite is a jQuery plugin that carries you on a carousel ride filled with images and HTML content.,javascript,1320584400000,1381705200000,no,http://www.gmarwaha.com/jquery/jcarousellite/,
55,ASP.NET Ajax,,"ASP.NET AJAX is a free framework for quickly creating a new generation of more efficient, more interactive and highly-personalized Web experiences that work across all the most popular browsers.",framework,1320584400000,1634886000000,no,http://ajax.asp.net,
56,Google Analytics,"['Application Performance', 'Audience Measurement', 'Visitor Count Tracking']",Google Analytics offers a host of compelling features and benefits for everyone from senior executives and advertising and marketing professionals to site owners and content developers.,analytics,1191308400000,1636268400000,no,http://google.com/analytics,
57,ASP.NET,,"ASP.NET is a web application framework marketed by Microsoft that programmers can use to build dynamic web sites, web applications and XML web services. It is part of Microsoft's .NET platform and is the successor to Microsoft's Active Server Pages (ASP) technology.",framework,1320584400000,1634886000000,no,http://www.asp.net,
58,Sitecore CMS,['Enterprise'],Sitecore provides web content management (CMS) and portal software for mid-large organisations.,cms,1320584400000,1343916000000,yes,http://sitecore.net,
59,Campaign Monitor,['Campaign Management'],Campaign Monitor  sends email newsletters and helps see the results.,mx,1345212000000,1633244400000,yes,http://www.campaignmonitor.com/,
60,Black Lotus,['US hosting'],DDoS customer protection service.,hosting,1345730400000,1381705200000,no,http://blacklotus.net,
61,SPF,,The Sender Policy Framework is an open standard specifying a technical method to prevent sender address forgery.,mx,1397084400000,1636268400000,no,http://www.openspf.org/,
62,GeoTrust SSL,['Root Authority'],Certificate provided by GeoTrust.,ssl,1401408000000,1581980400000,no,http://geotrust.com,
63,RapidSSL,,RapidSSL certificate provider.,ssl,1401408000000,1581980400000,no,http://rapidssl.com,
64,Font Awesome,['Fonts'],Iconic font and CSS toolkit.,widgets,1402873200000,1633244400000,no,http://fontawesome.io,
65,Facebook Custom Audiences,['Retargeting / Remarketing'],Custom Audiences from your website makes it possible to reach people who visit your website and deliver the right message to them on Facebook.,ads,1408575600000,1636268400000,no,https://developers.facebook.com/docs/reference/ads-api/custom-audience-website,
66,Amazon Sydney Region,['Australian hosting'],Amazon Hosted EC2 Instances in Sydney,hosting,1408575600000,1636268400000,no,http://aws.amazon.com,Amazon
67,Apple Mobile Web Clips Icon,,"This page contains an icon for iPhone, iPad and iTouch devices.",mobile,1413331200000,1636268400000,no,http://developer.apple.com/library/iOS/#documentation/AppleApplications/Reference/SafariWebContent/ConfiguringWebApplications/ConfiguringWebApplications.html,
68,Viewport Meta,,This page uses the viewport meta tag which means the content may be optimized for mobile content.,mobile,1413331200000,1636268400000,no,https://developers.google.com/speed/docs/insights/ConfigureViewport,
69,Facebook Tag API,"['Audience Measurement', 'Conversion Optimization']",The Javascript Tag API can be used to track custom audience and conversion events.,analytics,1424905200000,1581030000000,no,https://developers.facebook.com/docs/ads-for-websites/tag-api,
70,GFI,['Secure Email'],Email Security and Anti-Spam Provider.,mx,1425510000000,1573426800000,no,http://gfi.com,
71,Google Hosted Libraries,,"Google Hosted Libraries is a globally available content distribution network for the most popular, open-source JavaScript libraries.",javascript,1431302400000,1636268400000,no,https://developers.google.com/speed/libraries/,
72,Google Hosted jQuery,,jQuery hoted at Google.,javascript,1431302400000,1636268400000,no,https://developers.google.com/speed/libraries/,Google Hosted Libraries
73,jQuery 1.7.2,,jQuery version 1.7.2,javascript,1437606000000,1462402800000,no,http://blog.jquery.com/2012/03/21/jquery-1-7-2-released/,jQuery
74,Google Analytics Classic,,Classic Google Analytics - sites that are using non-universal analytics code.,analytics,1191308400000,1634799600000,no,https://developers.google.com/analytics/devguides/collection/gajs/,Google Analytics
75,Google Universal Analytics,,"The analytics.js JavaScript snippet is a new way to measure how users interact with your website. It is similar to the previous Google tracking code, ga.js, but offers more flexibility for developers to customize their implementations.",analytics,1448582400000,1636268400000,no,https://developers.google.com/analytics/devguides/collection/analyticsjs/,Google Analytics
76,Amazon CloudFront,['Edge Delivery Network'],Amazon CloudFront delivers your static and streaming content using a global network of edge locations.,cdns,1453935600000,1636268400000,yes,http://aws.amazon.com/cloudfront/,
77,Amazon SES,['Transactional Email'],"Amazon Simple Email Service (Amazon SES) is a  scalable, bulk, transactional email-sending service for businesses and developers.",mx,1458601200000,1636268400000,yes,http://aws.amazon.com/ses/,
78,MailChimp SPF,['Campaign Management'],This site has an SPF record for MailChimp managed email sending.,mx,1458601200000,1636268400000,maybe,http://mailchimp.com,
79,Dedicated Hosting,,This website is on an IP address not shared with other domains - it is more likely this website is not using shared hosting for this reason.,hosting,1458601200000,1462834800000,no,https://en.wikipedia.org/wiki/Dedicated_hosting_service,
80,Facebook Pixel,,Facebook Pixel is Facebooks conversion tracking system for ads on Facebook to websites.,analytics,1461193200000,1636268400000,no,https://www.facebook.com/business/help/952192354843755,
81,Slick JS,['Animation'],Fully responsive carousel library.,javascript,1462834800000,1634367600000,no,http://kenwheeler.github.io/slick,
82,Facebook Graph API,,This site has content that utilizes the Facebook Graph API,javascript,1463007600000,1559430000000,no,http://developers.facebook.com/docs/api,
83,Swipe JS,,Swipe is a lightweight mobile slider with 1:1 touch movement.,javascript,1462834800000,1633244400000,no,http://swipejs.com/,
84,touchSwipe,"['Compatibility', 'jQuery Plugin']","TouchSwipe is a jquery plugin to be used with jQuery on touch input devices such as iPad, iPhone etc.",javascript,1462834800000,1632294000000,no,https://github.com/mattbryson/TouchSwipe-Jquery-Plugin,
85,Zendesk,,"Organize, prioritize and engage with others on support requests.",mx,1462834800000,1473548400000,yes,http://www.zendesk.com/,
86,Google Tag Manager,['Tag Management'],Tag management that lets you add and update website tags without changes to underlying website code.,widgets,1463612400000,1636268400000,no,http://google.com/tagmanager,
87,Google Conversion Tracking,"['Conversion Optimization', 'Conversion Tracking']","This free tool in AdWords can show you what happens after customers click your ad (for example, whether they purchased your product, called from a mobile phone or downloaded your app).",analytics,1464303600000,1632294000000,no,https://support.google.com/adwords/answer/1722054,
88,SSL by Default,,The website redirects traffic to an HTTPS/SSL version by default.,ssl,1465426800000,1636268400000,no,http://trends.builtwith.com/ssl,
89,YouTube IFrame API,,The IFrame player API lets you embed a YouTube video player on your website and control the player using JavaScript,media,1485990000000,1636268400000,no,https://developers.google.com/youtube/iframe_api_reference,
90,Facebook Signal,,"Journalists use Signal to surface relevant trends, photos, videos and posts from Facebook and Instagram for use in their storytelling and reporting.",analytics,1504306800000,1636268400000,no,https://www.facebook.com/facebookmedia/get-started/signal,
91,jQuery 1.10.2,,jQuery version 1.10.2,javascript,1506639600000,1636268400000,no,https://blog.jquery.com/2013/07/03/jquery-1-10-2-and-2-0-3-released/,jQuery
92,Facebook Embedded Video,['Social Video Platform'],Facebook embedded video player.,media,1507244400000,1614326400000,no,https://developers.facebook.com/docs/plugins/embedded-video-player,
93,OptinMonster,"['Feedback Forms and Surveys', 'WordPress Plugins']",OptinMonster enables you to create professionally designed opt-in forms without writing code.,widgets,1507244400000,1636268400000,yes,http://optinmonster.com/,
94,MailGuard,['Secure Email'],Zero day spam and malware protection service from Australia.,mx,1518217200000,1636268400000,yes,http://mailguard.com.au,
95,jQuery UI,"['jQuery Plugin', 'UI']","jQuery UI provides abstractions for low-level interaction and animation, advanced effects and high-level, themeable widgets, built on top of the jQuery JavaScript Library, that you can use to build highly interactive web applications.",javascript,1519858800000,1636268400000,no,http://jqueryui.com/,jQuery
96,Bootstrap.js,['JavaScript Library'],Twitter Bootstrap JS components.,javascript,1519858800000,1634367600000,no,https://getbootstrap.com/javascript/,
97,Workplace by Facebook,,"Group discussion, a personalised News Feed, and voice and video calling from Facebook.",widgets,1519858800000,1552431600000,no,https://workplace.fb.com/,
98,Comodo SSL,['Root Authority'],Certificate provided by Comodo.,ssl,1518735600000,1584140400000,no,http://comodo.com,
99,Comodo PositiveSSL,,Comodo Positive SSL certificate.,ssl,1518735600000,1588287600000,no,http://www.positivessl.com/ssl-certificate-positivessl.php,
100,Comodo PositiveSSL Wildcard,['Wildcard'],Wildcard certificate from Comodo.,ssl,1518735600000,1588287600000,no,http://www.positivessl.com/ssl-certificate-positivessl_wildcard.php,
101,Amazon S3 CDN,,Amazon S3 is storage for the Internet. It is designed to make web-scale computing easier for developers.,cdns,1519858800000,1636268400000,no,http://aws.amazon.com/s3/,
102,Comodo EV,['Extended Validation'],Comodo Extended Validation (EV) SSL certificates.,ssl,1525734000000,1584140400000,yes,http://ssl.comodo.com/ev-ssl-certificates.php,Comodo SSL
103,IPhone / Mobile Compatible,,The website contains code that allows the page to support IPhone / Mobile Content.,mobile,1526338800000,1636268400000,no,http://apple.com,
104,Facebook Conversion Tracking,['Conversion Optimization'],"Conversion tracking functionality from Facebook, allows a user to track advertisement clicks.",analytics,1532991600000,1636268400000,no,http://www.facebook.com/help/?page=994,
105,Pound Sterling,['Currency'],The website uses the £ symbol on its website - meaning it may accept payment in this British currency.,payment,1537192800000,1621321200000,no,https://en.wikipedia.org/wiki/Pound_sign,
106,Japanese Yen,['Currency'],The website uses the ¥ symbol on its website - meaning it may accept payment in this Japanese currency.,payment,1537192800000,1621321200000,no,https://en.wikipedia.org/wiki/Japanese_yen,
107,Wistia,"['Enterprise', 'Online Video Platform', 'Video Analytics', 'Video Players']","Wistia is a video marketing, sales, and collaboration application.",media,1542322800000,1636268400000,yes,http://wistia.com,
108,reCAPTCHA,['CAPTCHA'],Anti-bot CAPTCHA widget from Google.,widgets,1542841200000,1636268400000,no,https://www.google.com/recaptcha/intro/index.html,
109,reCAPTCHA v2,,v2 of the Google reCAPTCHA system.,widgets,1542841200000,1636268400000,no,https://developers.google.com/recaptcha/docs/display,reCAPTCHA
110,Google Maps API,,Google Maps has a wide array of APIs that let you embed the functionality of Google Maps.,mapping,1542841200000,1636268400000,no,https://developers.google.com/maps/,
111,Google Maps,['Maps'],Google maps embedded into the webpage.,mapping,1542841200000,1636268400000,no,http://www.google.com/apis/maps/,
112,Google Maps for Work,,Google Maps for work.,mapping,1542841200000,1581030000000,no,https://www.google.com/work/mapsearth/,Google Maps
113,Crowdskout,['Community CMS'],Platform that powers campaigns and advocacy.,cms,1548543600000,1636268400000,yes,https://crowdskout.com,
114,Global Site Tag,,"Google's primary tag for Google Measurement/Conversion Tracking, Adwords and DoubleClick.",analytics,1553209200000,1634886000000,no,https://support.google.com/adwords/answer/7548399,
115,Apple Mobile Web App Status Bar Style,,Minimizes the status bar that is displayed at the top of the screen on iOS.,mobile,1554073200000,1636268400000,no,http://developer.apple.com/library/iOS/#documentation/AppleApplications/Reference/SafariWebContent/ConfiguringWebApplications/ConfiguringWebApplications.html,
116,Apache 2.4,,Apache version 2.4.*,Web Server,1554073200000,1636268400000,no,http://httpd.apache.org/docs/2.4,Apache
117,Google Remarketing,['Retargeting / Remarketing'],Google code specifically for remarketing/retargeting based advertising.,ads,1554073200000,1632294000000,no,http://www.google.com.au/ads/innovations/remarketing.html,
118,Google AdWords Conversion,"['Advertiser Tracking', 'Conversion Tracking']",Adwords conversion tracking code.,analytics,1559516400000,1632294000000,no,https://support.google.com/adwords/answer/6095821#get_tag,Google Conversion Tracking
119,Google Conversion Linker,,Detects the ad click information in your conversion page URLs and stores this information to associate an ad click with a conversion.,analytics,1559516400000,1632294000000,no,https://support.google.com/tagmanager/answer/7549390?hl=en,
120,Vue,['JavaScript Library'],vue.js a JavaScript MVVM framework.,javascript,1575414000000,1636268400000,no,http://vuejs.org,
121,Getty Images,['Image Provider'],This website has images that may have been sourced from Getty Images.,widgets,1578870000000,1579215600000,no,http://gettyimages.com,
122,COVID-19,,This website mentions COVID-19 / Novel Coronavirus.,widgets,1584745200000,1636268400000,no,https://www.who.int/emergencies/diseases/novel-coronavirus-2019,
123,WebFont Loader,,"WebFont Loader gives you added control when using linked fonts via @font-face, from Typekit.",javascript,1585263600000,1633244400000,no,https://github.com/typekit/webfontloader,
124,Google Hosted Web Font Loader,,Web Font Loader hosted at Google.,javascript,1585263600000,1633244400000,no,https://developers.google.com/speed/libraries/,Google Hosted Libraries
125,Sectigo SSL,,SSL from Sectigo formerly Comodo.,ssl,1585263600000,1636268400000,no,https://sectigo.com,
126,Sectigo EV SSL,['Extended Validation'],EV SSL from Sectigo formerly Comodo.,ssl,1585263600000,1636268400000,maybe,https://sectigo.com,Sectigo
127,DMARC,['DMARC'],A technical specification created by a group of organizations that want to help reduce the potential for email-based abuse,mx,1588287600000,1636268400000,no,http://www.dmarc.org,
