,Name,Categories,Description,Tag,FirstDetected,LastDetected,IsPremium,Link,Parent
128,Dmarcian,['DMARC'],DMARC SaaS platform for compliance.,mx,1588287600000,1636268400000,yes,https://dmarcian.com,
129,WebEx Panel,,WebEx system.,widgets,1592002800000,1592953200000,no,http://webex.com,
130,Australian English,,Website content is written in Australian English.,language,1597129200000,1636268400000,no,https://en.wikipedia.org/wiki/Language,
131,core-js,['Framework'],Modular standard library for JavaScript.,javascript,1601794800000,1636268400000,no,https://github.com/zloirock/core-js,
132,Facebook Login,['Login'],A way for users to log into your app using Facebook.,widgets,1601794800000,1636268400000,no,https://developers.facebook.com/docs/facebook-login/,
133,Careers,,The website contains a link to a careers / job opportunities / work with us style page.,link,1600383600000,1600383600000,no,https://kb.builtwith.com/special-reports/link-tracking/,
134,Amazon Virginia Region,['US hosting'],Amazon Hosted EC2 Instances in Virginia,hosting,1605081600000,1630047600000,no,http://aws.amazon.com,Amazon
135,Members Page,,The website contains a link to a members page or a members portal type or a membership page.,link,1616223600000,1636268400000,no,https://kb.builtwith.com/special-reports/link-tracking/,
136,Google Places Library,,Google places Library API for Google Maps,mapping,1627714800000,1636268400000,no,https://developers.google.com/maps/documentation/javascript/places,Google Maps
137,Sectigo Domain SSL,,SSL registration with Sectigo (formerly Comodo CA).,ssl,1629702000000,1634540400000,no,https://sectigo.com,Sectigo SSL
138,Dublin Core,,The website contains dublin core meta data extensions.,feeds,981014400000,1389567600000,no,http://dublincore.org,
139,Adobe Dreamweaver,,"Based on the use of certain javascript functions, this page contains code generated, at least initially, by Dreamweaver.",framework,981014400000,1204790400000,no,http://www.adobe.com/products/dreamweaver,
140,Adobe Active Content,,Changes effected Flash content in Internet Explorer - this library fixes them.,javascript,1204790400000,1255417200000,no,http://www.adobe.com/devnet/activecontent/,
141,Adobe Spry,,"The Spry framework for Ajax is a JavaScript library for web designers that provides functionality that allows designers to build pages that provide a richer experience for their users. It is designed to bring Ajax to the web design community who can benefit from Ajax, but are not well served by other frameworks.",javascript,1204790400000,1255417200000,no,http://labs.adobe.com/technologies/spry/,
142,script.aculo.us,['JavaScript Library'],"script.aculo.us provides you with easy-to-use, cross-browser user interface JavaScript libraries to make your web sites and web applications fly.",javascript,1204790400000,1255417200000,no,http://script.aculo.us/,
143,Euro,['Currency'],The website uses the € symbol on its website - meaning it may accept payment in Euros.,payment,1204790400000,1621321200000,no,https://en.wikipedia.org/wiki/Euro,
144,ClearSpring Widgets,,"The website uses widgets hosted at clearspring, now owned by AddThis.",widgets,1255417200000,1255417200000,no,http://www.clearspring.com,
145,Twitter Widget,,"Adds twitter to the website, this includes the user of a twitter badge, blogger JavaScript or anything from widgets.twimg.com.",widgets,1255417200000,1255417200000,no,http://twitter.com,
