,Name,Categories,Description,Tag,FirstDetected,LastDetected,IsPremium,Link,Parent
119,Akamai Edge,['Edge Delivery Network'],"Akamai's Edge Platform is one of the world's largest distributed computing platforms. It is a network of more than 95,000 secure servers equipped with proprietary software and deployed in 71 countries.",cdns,1465426800000,1511823600000,yes,http://www.akamai.com/html/technology/edgeplatform.html,
120,Apache 2.4,,Apache version 2.4.*,Web Server,1467154800000,1635490800000,no,http://httpd.apache.org/docs/2.4,Apache
121,Fizzy UI Utils,,UI utilities & helpers,javascript,1470265200000,1539471600000,no,https://github.com/metafizzy/fizzy-ui-utils,
122,Rubicon Project,,Advertising optimization service.,ads,1473548400000,1520636400000,no,http://rubiconproject.com,
123,Index Exchange,,Index Exchange is the world's fastest growing provider of online media solutions. With a network reach of over half the US digital audience. Previously known as Casale Media.,ads,1473548400000,1514329200000,no,http://casalemedia.com,
124,DoubleClick Bid Manager,['Demand-side Platform'],Programmatic buying platform.,ads,1480978800000,1521586800000,no,https://www.doubleclickbygoogle.com/solutions/digital-marketing/bid-manager/,
125,Pubmatic,['Dynamic Creative Optimization'],PubMatic Enables Ad Optimization Across Every Ad Network,ads,1480978800000,1502751600000,no,http://pubmatic.com,
126,Workplace by Facebook,,"Group discussion, a personalised News Feed, and voice and video calling from Facebook.",widgets,1487199600000,1490655600000,no,https://workplace.fb.com/,
127,Amazon Route 53,['Enterprise DNS'],Amazon's scalable DNS web service system.,ns,1490655600000,1636268400000,no,http://aws.amazon.com/route53/,
128,adingo,['Affiliate Programs'],Japanese based internet media traffic monetization solution. Also known as Fluct.,ads,1493679600000,1493679600000,no,http://adingo.jp,
129,Google Remarketing,['Retargeting / Remarketing'],Google code specifically for remarketing/retargeting based advertising.,ads,1499382000000,1628492400000,no,http://www.google.com.au/ads/innovations/remarketing.html,
130,Facebook Signal,,"Journalists use Signal to surface relevant trends, photos, videos and posts from Facebook and Instagram for use in their storytelling and reporting.",analytics,1501801200000,1635490800000,no,https://www.facebook.com/facebookmedia/get-started/signal,
131,LiveRamp,"['Lead Generation', 'Marketing Automation']",CRM Retargeting & Data Onboarding app.,analytics,1502751600000,1514329200000,yes,http://liveramp.com/,
132,imagesLoaded,,jQuery plugin for seeing if the images are loaded.,javascript,1504825200000,1636268400000,no,https://github.com/desandro/imagesloaded,
133,TinyMCE,,TinyMCE editor.,widgets,1505084400000,1512601200000,no,https://github.com/tinymce/tinymce-dist,
134,Magnific Popup,,Magnific Popup is a responsive lightbox & dialog script.,javascript,1505775600000,1635490800000,no,http://dimsemenov.com/plugins/magnific-popup/,
135,Qualtrics Site Intercept,['Feedback Forms and Surveys'],Adds forms into the website for the visitor to provide feedback.,widgets,1512342000000,1535065200000,maybe,https://www.qualtrics.com/si/,
136,TurboLinks,,Turbolinks is a recompilation speed up tool for Ruby on Rails.,widgets,1513897200000,1535065200000,no,https://github.com/rails/turbolinks,
137,LetsEncrypt,['Root Authority'],Let’s Encrypt is a free open Certificate Authority.,ssl,1518217200000,1636268400000,no,https://letsencrypt.org,
138,Amazon Sydney Region,['Australian hosting'],Amazon Hosted EC2 Instances in Sydney,hosting,1518735600000,1636182000000,no,http://aws.amazon.com,Amazon
139,SSL by Default,,The website redirects traffic to an HTTPS/SSL version by default.,ssl,1519858800000,1636268400000,no,http://trends.builtwith.com/ssl,
140,Hotjar,"['Audience Measurement', 'Conversion Optimization', 'Feedback Forms and Surveys']","A heatmap, survey, feedback and funnel application.",analytics,1525302000000,1636268400000,yes,http://hotjar.com,
141,IPhone / Mobile Compatible,,The website contains code that allows the page to support IPhone / Mobile Content.,mobile,1526598000000,1636268400000,no,http://apple.com,
142,Facebook Conversion Tracking,['Conversion Optimization'],"Conversion tracking functionality from Facebook, allows a user to track advertisement clicks.",analytics,1531436400000,1636009200000,no,http://www.facebook.com/help/?page=994,
143,Microsoft,['US hosting'],This site is hosted on Microsoft infrastructure,hosting,1535583600000,1636268400000,no,http://www.microsoft.com,
144,jQuery CDN,,The jQuery Amazon S3 Content Delivery Network,cdn,1535670000000,1636268400000,no,http://blog.jquery.com/2008/11/19/cloudfront-cdn-for-jquery/,
145,Global Site Tag,,"Google's primary tag for Google Measurement/Conversion Tracking, Adwords and DoubleClick.",analytics,1535670000000,1636268400000,no,https://support.google.com/adwords/answer/7548399,
146,CDN JS,,CloudFlare's CDN with popular javascript frameworks available.,cdn,1535670000000,1636268400000,no,http://cdnjs.com,
147,Popper.js,,A library to manage your pop ups.,javascript,1535670000000,1636268400000,no,https://popper.js.org/,
148,OWL Carousel,['Slider'],Touch enabled jQuery plugin that lets you create a carousel slider.,javascript,1535670000000,1636268400000,no,http://owlgraphic.com/owlcarousel/,
149,Stripe,"['Checkout Buttons', 'Payments Processor']",Stripe makes it easy for developers to accept credit cards on the web.,payment,1535670000000,1636268400000,no,https://stripe.com/,
150,Stripe v3,,Version 3 of Stripe Integration.,payment,1535670000000,1636268400000,no,https://stripe.com,Stripe
151,Webpack,,webpack takes modules with dependencies and generates static assets representing those modules.,javascript,1535756400000,1636268400000,no,http://webpack.github.io/,
152,es6 promise,,A polyfill for ES6-style Promises.,javascript,1535756400000,1636268400000,no,https://github.com/stefanpenner/es6-promise,
153,React,['JavaScript Library'],A JavaScript library for building user interfaces from Facebook.,javascript,1535756400000,1636268400000,no,https://reactjs.org/,
154,Rocket Chat,['Live Chat'],Open Source Web Chat Platform,widgets,1535756400000,1628492400000,yes,http://rocket.chat,
155,Facebook Domain Verification,,Domain Verification provides a way for you to claim ownership of your domain in Facebook Business Manager.,framework,1540508400000,1636268400000,no,https://developers.facebook.com/docs/sharing/domain-verification/,
156,Fastly CDN,,Links to fastly CDN based content.,cdn,1549234800000,1556838000000,no,http://fastly.com,
157,Microsoft Azure,"['Cloud Hosting', 'Cloud PaaS']",Hosted on Microsoft Azure.,hosting,1549839600000,1636268400000,no,http://azure.microsoft.com,
158,Microsoft Azure Australia South East Region,['Australian hosting'],Microsoft Azure hosted Australia South East Coast Melbourne Region.,hosting,1549839600000,1636268400000,no,https://azure.microsoft.com,Microsoft Azure
159,jQuery 3.3.1,,jQuery version 3.3.1,javascript,1553209200000,1636268400000,no,https://blog.jquery.com/2018/01/20/jquery-3-3-1-fixed-dependencies-in-release-tag/,jQuery
160,Google AdWords Conversion,"['Advertiser Tracking', 'Conversion Tracking']",Adwords conversion tracking code.,analytics,1557615600000,1636268400000,no,https://support.google.com/adwords/answer/6095821#get_tag,Google Conversion Tracking
161,Microsoft Azure DNS,,This domain is verified with Microsoft Azure.,mx,1568934000000,1636268400000,no,http://windowsazure.com,
162,AdRoll CMP System,['Privacy Compliance'],IAB digital advertising consent integration by AdRoll CMP System.,widgets,1574290800000,1628492400000,no,http://adroll.com,GDPR Consent Management Platform
163,GDPR Consent Management Platform,['Privacy Compliance'],Consumer-facing consent management solution for GDPR compliance based on the IAB Europe's Transparency & Consent framework.,widgets,1574290800000,1628492400000,no,https://iabeurope.eu/tcf-for-cmps/,
164,COVID-19,,This website mentions COVID-19 / Novel Coronavirus.,widgets,1585609200000,1636268400000,no,https://www.who.int/emergencies/diseases/novel-coronavirus-2019,
165,Adobe Connect,,"Adobe Connect web conferencing software offers online meeting functionality, virtual classrooms and large scale webinars.",widgets,1586473200000,1589842800000,maybe,http://www.adobe.com/products/adobeconnect.html,
166,core-js,['Framework'],Modular standard library for JavaScript.,javascript,1588114800000,1636268400000,no,https://github.com/zloirock/core-js,
167,OwlCarousel2,,Touch enabled jQuery plugin that lets you create a responsive carousel slider.,javascript,1588114800000,1636268400000,no,https://github.com/smashingboxes/OwlCarousel2,
168,DMARC,['DMARC'],A technical specification created by a group of organizations that want to help reduce the potential for email-based abuse,mx,1588114800000,1636268400000,no,http://www.dmarc.org,
169,Microsoft Exchange Online,['Business Email Hosting'],A rich hosted Exchange environment for every user without having to manage a server.,mx,1593903600000,1636268400000,no,http://www.microsoft.com/exchange/en-us/exchange-online-hosted-email.aspx,
170,Pound Sterling,['Currency'],The website uses the £ symbol on its website - meaning it may accept payment in this British currency.,payment,1597906800000,1597906800000,no,https://en.wikipedia.org/wiki/Pound_sign,
171,Japanese Yen,['Currency'],The website uses the ¥ symbol on its website - meaning it may accept payment in this Japanese currency.,payment,1597906800000,1597906800000,no,https://en.wikipedia.org/wiki/Japanese_yen,
172,Cloudflare JS,,Loads content from Cloudflare CDN.,cdn,1599807600000,1636268400000,no,https://cloudflare.com,
173,Careers,,The website contains a link to a careers / job opportunities / work with us style page.,link,1599807600000,1636268400000,no,https://kb.builtwith.com/special-reports/link-tracking/,
174,Valimail,['Secure Email'],Cybersecurity solution for blocking phishing emails.,mx,1599807600000,1636268400000,maybe,https://valimail.com,
175,Google Optimize 360,"['A/B Testing', 'Personalization']",Test different variations of a website and then tailor it to deliver a personalized experience that works best for each customer and for your business.,analytics,1602745200000,1636268400000,maybe,https://www.google.com/analytics/optimize/,
176,Algolia,['Site Search'],Algolia's Search API makes it possible to deliver a search experience in your apps & websites.,widgets,1602745200000,1628492400000,yes,http://algolia.com,
177,Popper,['WordPress Theme'],"Designed and built around three basic principles - acccessibility, mobile- and touch friendly design, and content in focus - Popper is a great option whether you are building a site, a portfolio, or a blog by Morten Rand-Hendriksen.",framework,1612252800000,1633158000000,no,http://mor10.com/popper/,
178,Members Page,,The website contains a link to a members page or a members portal type or a membership page.,link,1616540400000,1636268400000,no,https://kb.builtwith.com/special-reports/link-tracking/,
179,Facebook Login,['Login'],A way for users to log into your app using Facebook.,widgets,1624690800000,1635490800000,no,https://developers.facebook.com/docs/facebook-login/,
180,EditPlus,,"EditPlus is a text editor, HTML editor, PHP editor, Java editor and Hex Viewer for Windows. While it can serve as a good Notepad replacement, it also offers features for Web page authors and programmers.",cms,1034114400000,1064959200000,no,http://www.editplus.com/,
181,Adobe Dreamweaver,,"Based on the use of certain javascript functions, this page contains code generated, at least initially, by Dreamweaver.",framework,1096581600000,1167951600000,no,http://www.adobe.com/products/dreamweaver,
182,MooTools,['JavaScript Library'],"MooTools is a compact, modular, Object-Oriented JavaScript framework designed for the intermediate to advanced JavaScript developer. It allows you to write powerful, flexible and cross-browser code with its elegant, well documented and coherent API.",javascript,1191276000000,1518735600000,no,http://mootools.net/,
183,Euro,['Currency'],The website uses the € symbol on its website - meaning it may accept payment in Euros.,payment,1286229600000,1634367600000,no,https://en.wikipedia.org/wiki/Euro,
184,jQuery 1.4.2,,jQuery version 1.4.2,javascript,1286229600000,1407970800000,no,http://blog.jquery.com/2010/02/19/jquery-142-released/,jQuery
185,jsDelivr,,"A free CDN where Javascript developers can host their files. Encompasses MaxCDN, and BootstrapCDN.",cdn,1625468400000,1636268400000,no,http://www.jsdelivr.com/,
186,Google Conversion Linker,,Detects the ad click information in your conversion page URLs and stores this information to associate an ad click with a conversion.,analytics,1625468400000,1636268400000,no,https://support.google.com/tagmanager/answer/7549390?hl=en,
187,Google Analytics 4,,Google Analytics 4 formerly known as App + Web is a new version of Google Analytics that was released in October 2020.,analytics,1628492400000,1628492400000,no,https://support.google.com/analytics/answer/10089681?hl=en,Google Analytics
188,Visa,['Payment Acceptance'],The website accepts payments with Visa.,payment,1629270000000,1636009200000,no,http://visa.com,
189,Intersection Observer,,API that can be used to understand the visibility and position of DOM elements relative to a containing element or to the top-level viewport.,javascript,1632553200000,1636268400000,no,https://www.w3.org/TR/intersection-observer/,
