,Name,Categories,Description,Tag,FirstDetected,LastDetected,IsPremium,Link,Parent
137,Comodo PositiveSSL Wildcard,['Wildcard'],Wildcard certificate from Comodo.,ssl,1567983600000,1586214000000,no,http://www.positivessl.com/ssl-certificate-positivessl_wildcard.php,
138,Office 365 Mail,['Business Email Hosting'],Email sent from this domain has records showing Office 365 usage.,mx,1582671600000,1636444800000,no,https://products.office.com/en-us/business/office,
139,MailChimp SPF,['Campaign Management'],This site has an SPF record for MailChimp managed email sending.,mx,1582671600000,1636444800000,maybe,http://mailchimp.com,
140,COVID-19,,This website mentions COVID-19 / Novel Coronavirus.,widgets,1585263600000,1636444800000,no,https://www.who.int/emergencies/diseases/novel-coronavirus-2019,
141,Advanced iFrame,['WordPress Plugins'],Embed iframe content into Wordpress.,widgets,1588892400000,1636444800000,no,https://wordpress.org/plugins/advanced-iframe/,
142,Facebook Domain Insights,['Social Management'],This website contains tracking information that allows admins to see Facebook Insights out of Facebook to this domain.,analytics,1588892400000,1607846400000,no,http://www.facebook.com/insights/,
143,core-js,['Framework'],Modular standard library for JavaScript.,javascript,1589929200000,1636268400000,no,https://github.com/zloirock/core-js,
144,jsDelivr,,"A free CDN where Javascript developers can host their files. Encompasses MaxCDN, and BootstrapCDN.",cdn,1592694000000,1636268400000,no,http://www.jsdelivr.com/,
145,jQuery UI,"['jQuery Plugin', 'UI']","jQuery UI provides abstractions for low-level interaction and animation, advanced effects and high-level, themeable widgets, built on top of the jQuery JavaScript Library, that you can use to build highly interactive web applications.",javascript,1592694000000,1635663600000,no,http://jqueryui.com/,jQuery
146,WooCommerce 4.2,,WooCommerce version 4.2.*,shop,1593644400000,1593644400000,no,http://woocommerce.com,WooCommerce
147,Global Site Tag,,"Google's primary tag for Google Measurement/Conversion Tracking, Adwords and DoubleClick.",analytics,1593644400000,1636444800000,no,https://support.google.com/adwords/answer/7548399,
148,Google AdWords Conversion,"['Advertiser Tracking', 'Conversion Tracking']",Adwords conversion tracking code.,analytics,1593644400000,1636444800000,no,https://support.google.com/adwords/answer/6095821#get_tag,Google Conversion Tracking
149,Google Conversion Tracking,"['Conversion Optimization', 'Conversion Tracking']","This free tool in AdWords can show you what happens after customers click your ad (for example, whether they purchased your product, called from a mobile phone or downloaded your app).",analytics,1593644400000,1636444800000,no,https://support.google.com/adwords/answer/1722054,
150,Slick,,Standalone CSS Selector Parser and Engine from MooTools.,javascript,1591052400000,1633158000000,no,https://github.com/mootools/slick,
151,SweetAlert2,,"A responsive, customizable and accessible replacement for JavaScript's popup boxes, supported fork of sweetalert.",javascript,1593673200000,1596351600000,no,https://sweetalert2.github.io,
152,Google Tag Manager,['Tag Management'],Tag management that lets you add and update website tags without changes to underlying website code.,widgets,1593673200000,1636444800000,no,http://google.com/tagmanager,
153,Google Remarketing,['Retargeting / Remarketing'],Google code specifically for remarketing/retargeting based advertising.,ads,1599721200000,1632553200000,no,http://www.google.com.au/ads/innovations/remarketing.html,
154,Facebook Login,['Login'],A way for users to log into your app using Facebook.,widgets,1599721200000,1635231600000,no,https://developers.facebook.com/docs/facebook-login/,
155,DoubleClick Bid Manager,['Demand-side Platform'],Programmatic buying platform.,ads,1601190000000,1629183600000,no,https://www.doubleclickbygoogle.com/solutions/digital-marketing/bid-manager/,
156,YouTube Privacy Enchanced,,Contains YouTube no cookie content.,media,1603350000000,1636444800000,no,https://youtube.com,
157,instant.page,,Make your site website pages load very quickly.,javascript,1605081600000,1636268400000,no,https://instant.page/,
158,Organization Schema,['Schema'],"Organization i.e. school, NGO, Corporation.",framework,1606118400000,1636444800000,no,https://schema.org/Organization,
159,WooCommerce Conversion Tracking,"['Non Platform', 'WooCommerce Extension']",WooCommerce cart conversion tracking code from weDevs.,shop,1611129600000,1629183600000,no,https://wordpress.org/plugins/woocommerce-conversion-tracking/,WooCommerce
160,WooCommerce Name Your Price,"['Non Platform', 'WooCommerce Extension']",Let customers pay what they would like to.,shop,1611129600000,1629183600000,yes,https://woocommerce.com/products/name-your-price/,WooCommerce
161,Combell,['Cloud Hosting'],Combell provides cloud services and is based in Belgium.,hosting,1611129600000,1636444800000,no,http://combell.com,
162,Adobe Dreamweaver,,"Based on the use of certain javascript functions, this page contains code generated, at least initially, by Dreamweaver.",framework,1128117600000,1167778800000,no,http://www.adobe.com/products/dreamweaver,
163,Sitestat,['Audience Measurement'],Sitestat is the professional version of nedstat free analytics tool. Now owned by comScore.,analytics,1136847600000,1136847600000,maybe,http://www.nedstat.com/web/nedstatuk.nsf/pages/sitestat_web_analytics,
164,Google Analytics Classic,,Classic Google Analytics - sites that are using non-universal analytics code.,analytics,1224885600000,1286834400000,no,https://developers.google.com/analytics/devguides/collection/gajs/,Google Analytics
165,WooCommerce 5.3,,WooCommerce version 5.3.*,shop,1623481200000,1623481200000,no,http://woocommerce.com,WooCommerce
166,WooCommerce 5.4,,WooCommerce version 5.4.*,shop,1623826800000,1626159600000,no,http://woocommerce.com,WooCommerce
167,WooCommerce,['Non Platform'],Transforms your WordPress website into an online store.,shop,1625209200000,1636444800000,no,https://woocommerce.com,
168,WooCommerce 5.5,,WooCommerce version 5.5.*,shop,1627369200000,1629183600000,no,http://woocommerce.com,WooCommerce
169,GTM4WP,['WordPress Plugins'],Google Tag Manager for WordPress Plugin,widgets,1627714800000,1636444800000,no,https://gtm4wp.com,
170,Intersection Observer,,API that can be used to understand the visibility and position of DOM elements relative to a containing element or to the top-level viewport.,javascript,1632553200000,1636268400000,no,https://www.w3.org/TR/intersection-observer/,
171,SendinBlue,['Marketing Platform'],"Marketing campaigns, Transactional Emails, and SMS messages all in one platform.",mx,1633590000000,1636444800000,yes,http://www.sendinblue.com,
172,DMARC,['DMARC'],A technical specification created by a group of organizations that want to help reduce the potential for email-based abuse,mx,1633935600000,1636268400000,no,http://www.dmarc.org,
