,Name,Categories,Description,Tag,FirstDetected,LastDetected,IsPremium,Link,Parent
133,eXelate,,The first and largest open marketplace for behavioral targeting data.,ads,1563231600000,1602486000000,no,http://www.exelate.com,
134,DemDex,"['Audience Targeting', 'Multi-Channel']","Demdex's turn-key audience management solutions make implementing a dynamic, multi-channel data strategy cost-effective and easy. Now known as Adobe Audience Manager.",ads,1563231600000,1589842800000,no,http://www.demdex.com/,
135,Adobe Audience Manager Sync,,DMP Platform from Adobe Cookie Sync.,ads,1563231600000,1589842800000,no,http://www.adobe.com/au/marketing-cloud/data-management-platform.html,
136,LiveRamp,"['Lead Generation', 'Marketing Automation']",CRM Retargeting & Data Onboarding app.,analytics,1563231600000,1587337200000,yes,http://liveramp.com/,
137,Rapleaf,['Marketing Automation'],Marketing automation tools with the necessary data to help brands keep their customers engaged. Now TowerData.,analytics,1563231600000,1587337200000,yes,http://www.rapleaf.com,
138,BlueKai,['Ad Exchange'],The BlueKai Data Exchange enables partners to buy and own data to boost ad targeting across any media.,ads,1563231600000,1602486000000,no,http://bluekai.com,
139,BlueKai DMP,['Data Management Platform'],BlueKai sites that specifically call a tags script.,ads,1563231600000,1602486000000,no,http://bluekai.com,BlueKai
140,The Trade Desk,['Demand-side Platform'],Data-driven marketing suite that offers marketers a single place to buy all forms of online media.,ads,1563231600000,1633935600000,no,http://www.thetradedesk.com,
141,Datonics,,"Datonics AlmondNet partners with data-owners and media-owners to provide consumers with relevant, privacy-sensitive ads.",ads,1563231600000,1601449200000,no,http://www.almondnet.com/,
142,Foundation,,A responsive front-end framework.,framework,1563231600000,1633158000000,no,http://foundation.zurb.com/,
143,jQuery Masonry,['UI'],Masonry is a layout plugin for jQuery. Think of it as the flip side of CSS floats.,javascript,1563231600000,1619420400000,no,http://desandro.com/resources/jquery-masonry/,jQuery
144,Fizzy UI Utils,,UI utilities & helpers,javascript,1563231600000,1619420400000,no,https://github.com/metafizzy/fizzy-ui-utils,
145,GSAP,['Animation'],"GSAP is a suite of tools for scripted, high-performance HTML5 animations that work in all major browsers from GreenSock.",javascript,1563231600000,1636268400000,no,http://greensock.com/gsap/,
146,Tapad,,Allows advertisers to engage the same consumer with consistent ads across multiple platforms.,ads,1572649200000,1613980800000,no,http://www.tapad.com/,
147,Burst Media,['Ad Network'],Internet advertising network representing specialty-content web sites.,ads,1573686000000,1602486000000,no,http://burstmedia.com,
148,Pound Sterling,['Currency'],The website uses the £ symbol on its website - meaning it may accept payment in this British currency.,payment,1573772400000,1602543600000,no,https://en.wikipedia.org/wiki/Pound_sign,
149,Lotame Crowd Control,,Data driven marketing advertising program provides social media sites with advance targeting,analytics,1575414000000,1587337200000,no,http://lotame.com,
150,COVID-19,,This website mentions COVID-19 / Novel Coronavirus.,widgets,1584140400000,1631257200000,no,https://www.who.int/emergencies/diseases/novel-coronavirus-2019,
151,Baidu Bot Disallow,,The website has disallow rules for Baidu Baiduspider bot.,robots,1593471600000,1636268400000,no,https://www.baidu.com/search/robots_english.html,
152,Exalead Bot Disallow,,The website has disallow rules for Exalead Exabot.,robots,1593471600000,1636268400000,no,https://www.exalead.com/search/webmasterguide,
153,Googlebot Disallow,,The website has disallow rules for Google Search Bot.,robots,1593471600000,1636268400000,no,https://developers.google.com/search/reference/robots_txt,
154,Slick,,Standalone CSS Selector Parser and Engine from MooTools.,javascript,1591052400000,1633158000000,no,https://github.com/mootools/slick,
155,Cloudflare Rocket Loader,['Application Performance'],Automatically optimizes your pages to minimize the number of network connections and ensure even third party resources won't slow down page rendering.,analytics,1599634800000,1636268400000,no,https://www.cloudflare.com/features-optimizer,
156,Japanese Yen,['Currency'],The website uses the ¥ symbol on its website - meaning it may accept payment in this Japanese currency.,payment,1602543600000,1602543600000,no,https://en.wikipedia.org/wiki/Japanese_yen,
157,Gravity Forms,['Feedback Forms and Surveys'],Contact Forms for WordPress.,widgets,1605394800000,1636268400000,yes,http://www.gravityforms.com/,
158,Mandrill,['Transactional Email'],Mandrill is an email infrastructure service. Detailed analytics offer insight to measure email performance.,mx,1608246000000,1636268400000,yes,http://mandrill.com/,
159,Typekit,,Typekit is the easiest way to use real fonts on the web. It's a subscription-based service for linking to high-quality Open Type fonts from some of the world's best type foundries.,widgets,1614672000000,1636268400000,no,http://typekit.com,
160,Events Page,,"The website contains a link to an ""Events"" or ""Calendar"" page.",link,1614931200000,1636268400000,no,https://kb.builtwith.com/special-reports/link-tracking/,
161,Members Page,,The website contains a link to a members page or a members portal type or a membership page.,link,1615935600000,1627196400000,no,https://kb.builtwith.com/special-reports/link-tracking/,
162,Microsoft Exchange Online,['Business Email Hosting'],A rich hosted Exchange environment for every user without having to manage a server.,mx,1617750000000,1636268400000,no,http://www.microsoft.com/exchange/en-us/exchange-online-hosted-email.aspx,
163,Office 365 Mail,['Business Email Hosting'],Email sent from this domain has records showing Office 365 usage.,mx,1617750000000,1636268400000,no,https://products.office.com/en-us/business/office,
164,Salesforce SPF,,This site uses Salesforce.com to send emails.,mx,1618527600000,1636268400000,yes,http://salesforce.com,
165,DMARC,['DMARC'],A technical specification created by a group of organizations that want to help reduce the potential for email-based abuse,mx,1618642800000,1636268400000,no,http://www.dmarc.org,
166,reCAPTCHA,['CAPTCHA'],Anti-bot CAPTCHA widget from Google.,widgets,1628146800000,1636268400000,no,https://www.google.com/recaptcha/intro/index.html,
167,jQuery 3.6.0,,jQuery version 3.6.0,javascript,1627714800000,1636268400000,no,https://blog.jquery.com/2021/03/02/jquery-3-6-0-released/,jQuery
168,WP Rocket,['WordPress Plugins'],Cache plugin for WordPress from France.,widgets,1627714800000,1636268400000,maybe,http://wp-rocket.me,
169,ScrollMagic,,The javascript library for magical scroll interactions.,javascript,1630047600000,1636268400000,no,http://janpaepke.github.io/ScrollMagic/,
170,Amazon SSL,,Amazon supplied SSL certificate,ssl,1629702000000,1636182000000,no,https://amazon.com,
171,Entrust EV,['Extended Validation'],EV certificate fron Entrust.,ssl,1629702000000,1634540400000,yes,http://www.entrust.net,
172,Amazon ELB Oregon,,Amazon Elastic Load Balancing setup in Oregon region.,hosting,1630047600000,1635490800000,no,https://aws.amazon.com/elasticloadbalancing/,Amazon Elastic Load Balancing
173,Intersection Observer,,API that can be used to understand the visibility and position of DOM elements relative to a containing element or to the top-level viewport.,javascript,1632553200000,1636268400000,no,https://www.w3.org/TR/intersection-observer/,
