,Name,Categories,Description,Tag,FirstDetected,LastDetected,IsPremium,Link,Parent
0,Comodo InstantSSL,,InstantSSL solutions from Comodo.,ssl,1378422000000,1424905200000,no,http://www.instantssl.com/,
1,Comodo SSL,['Root Authority'],Certificate provided by Comodo.,ssl,1378422000000,1488582000000,no,http://comodo.com,
2,IIS 6,,Internet-based service for servers using Microsoft Windows. It is the world's second most popular web server in terms of overall websites.,Web Server,1371942000000,1400454000000,no,http://www.iis.net,IIS
3,ASP.NET,,"ASP.NET is a web application framework marketed by Microsoft that programmers can use to build dynamic web sites, web applications and XML web services. It is part of Microsoft's .NET platform and is the successor to Microsoft's Active Server Pages (ASP) technology.",framework,1371942000000,1491692400000,no,http://www.asp.net,
4,Google Analytics,"['Application Performance', 'Audience Measurement', 'Visitor Count Tracking']",Google Analytics offers a host of compelling features and benefits for everyone from senior executives and advertising and marketing professionals to site owners and content developers.,analytics,1319925600000,1491692400000,no,http://google.com/analytics,
5,IIS,,This website is running on a Microsoft IIS Server solution.,Web Server,1371942000000,1636182000000,no,http://www.microsoft.com/servers/home.mspx,
6,Online.net,"['Dedicated Hosting', 'French hosting']",French dedicated and shared hosting provider.,hosting,1371942000000,1427238000000,no,http://online.net,
7,Online.Net DNS,,French based hosting and DNS services solution provider.,ns,1362056400000,1491692400000,no,http://online.net,
8,IIS 8,,Internet-based services for servers using Microsoft Windows.,Web Server,1403046000000,1491692400000,no,http://www.iis.net,IIS
9,Google Analytics Classic,,Classic Google Analytics - sites that are using non-universal analytics code.,analytics,1319925600000,1491692400000,no,https://developers.google.com/analytics/devguides/collection/gajs/,Google Analytics
10,Vimeo,"['Online Video Platform', 'Video Players']","Use Vimeo to exchange videos with only the people you want to. We have a bunch of different privacy options so you can choose exactly who can see your videos, and others can do the same. The website embeds vimeo.",media,1461106800000,1636268400000,no,http://vimeo.com,
11,Versatel Deutschland,['German hosting'],Network infrastructure from Versatel Deutschland based in Germany.,hosting,1462834800000,1491692400000,no,http://versatel.de,
12,Vimeo CDN,,This page uses content from the Vimeo CDN.,cdn,1463612400000,1476140400000,no,http://vimeo.com,
13,WordPress Grid,,Contains content that may be hosted on the WordPress Grid Hosting CDN.,cdn,1463612400000,1465426800000,no,http://vip.wordpress.com/,
14,Slider Revolution,['WordPress Plugins'],A response sliding image plugin.,widgets,1494630000000,1636268400000,no,http://codecanyon.net/item/slider-revolution-responsive-wordpress-plugin/2751380?ref=garazy,
15,jQuery,['JavaScript Library'],"JQuery is a fast, concise, JavaScript Library that simplifies how you traverse HTML documents, handle events, perform animations, and add Ajax interactions to your web pages. jQuery is designed to change the way that you write JavaScript.",javascript,1494630000000,1636268400000,no,http://jquery.com,jQuery
16,LayerSlider Responsive,['WordPress Plugins'],LayerSlider is the most advanced Responsive WordPress Slider Plugin.,widgets,1494630000000,1636268400000,no,http://kreaturamedia.com/layerslider-responsive-wordpress-slider-plugin/,
17,Facebook CDN,,This page has content that links to the Facebook content delivery network.,cdn,1494630000000,1568761200000,no,http://www.facebook.com,
18,Fizzy UI Utils,,UI utilities & helpers,javascript,1494630000000,1568761200000,no,https://github.com/metafizzy/fizzy-ui-utils,
19,Really Simple Discovery,,"Really Simple Discovery is a way to help client software find the services needed to read, edit, or ""work with"" weblogging software.",feeds,1494630000000,1636268400000,no,http://cyber.law.harvard.edu/blogs/gems/tech/rsd.html,
20,Font Awesome,['Fonts'],Iconic font and CSS toolkit.,widgets,1494630000000,1636268400000,no,http://fontawesome.io,
21,bxSlider,"['jQuery Plugin', 'Slider', 'UI']",Response jQuery Content Slider,javascript,1494630000000,1636268400000,no,http://bxslider.com/,
22,Amazon,"['Cloud Hosting', 'Cloud PaaS']",This site is hosted on Amazon AWS EC2 Infrastructure.,hosting,1494630000000,1636268400000,no,http://aws.amazon.com,
23,jQuery Masonry,['UI'],Masonry is a layout plugin for jQuery. Think of it as the flip side of CSS floats.,javascript,1494630000000,1636268400000,no,http://desandro.com/resources/jquery-masonry/,jQuery
24,Twitter Timeline,,"Add your tweets, favourites or searches as a timeline to the website.",widgets,1494630000000,1636268400000,no,http://twitter.com/settings/widgets,
25,GSAP,['Animation'],"GSAP is a suite of tools for scripted, high-performance HTML5 animations that work in all major browsers from GreenSock.",javascript,1494630000000,1635404400000,no,http://greensock.com/gsap/,
26,ThemePunch,,Using custom plugins/themes from ThemePunch.,widgets,1494630000000,1568761200000,no,http://www.themepunch.com,
27,WP Polls,['WordPress Plugins'],Customizable user polling system for WordPress.,widgets,1494630000000,1636268400000,no,http://wordpress.org/plugins/wp-polls,
28,RSS,,"A family of web feed formats used to publish frequently updated content such as blog entries, news headlines or podcasts.",feeds,1494630000000,1636268400000,no,http://en.wikipedia.org/wiki/RSS_(file_format),
29,Froogaloop,,"Froogaloop is a small Javascript utility framework to help with the complexities
involved in dealing with using the Javascript API through window.postMessage
for controlling Vimeo's Moogaloop video player.",javascript,1494630000000,1527980400000,no,https://github.com/vimeo/froogaloop,
30,SPF,,The Sender Policy Framework is an open standard specifying a technical method to prevent sender address forgery.,mx,1494630000000,1636268400000,no,http://www.openspf.org/,
31,Apple Mobile Web Clips Icon,,"This page contains an icon for iPhone, iPad and iTouch devices.",mobile,1494630000000,1636268400000,no,http://developer.apple.com/library/iOS/#documentation/AppleApplications/Reference/SafariWebContent/ConfiguringWebApplications/ConfiguringWebApplications.html,
32,Live Writer Support,,Windows Live Writer Tagging Support Schema,feeds,1494630000000,1636268400000,no,http://windowslivewriter.spaces.live.com,
33,Wordpress Plugins,,Plugins are tools to extend the functionality of WordPress. The website uses various plugins from WordPress to provide additional functionality. Some of them may be listed here.,widgets,1494630000000,1636268400000,no,http://codex.wordpress.org/Plugins,
34,Twemoji,,Twitter Emoji for Everyone,widgets,1494630000000,1635231600000,no,https://github.com/twitter/twemoji,
35,Google Font API,['Fonts'],The Google Font API helps you add web fonts to any web page.,widgets,1494630000000,1636268400000,no,https://fonts.google.com,
36,jQuery Form,['jQuery Plugin'],jQuery Form Plugin allows you to easily and unobtrusively upgrade HTML forms to use AJAX.,javascript,1494630000000,1496358000000,no,http://jquery.malsup.com/form/,jQuery
37,WP Rocket,['WordPress Plugins'],Cache plugin for WordPress from France.,widgets,1494630000000,1636268400000,maybe,http://wp-rocket.me,
38,Twitter Platform,,The page embeds the Twitter platform in one method or another.,javascript,1494630000000,1636268400000,no,http://twitter.com/about/resources,
39,Facebook SDK,," JavaScript SDK enables you to access all of the features of the Graph API via JavaScript, and it provides a rich set of client-side functionality for authentication and sharing. It differs from Facebook Connect.",javascript,1494630000000,1636268400000,no,http://developers.facebook.com/docs/reference/javascript/,
40,Twitter CDN,,"This page contains content sourced from the Twitter CDN, either by the use of Widgets or linking to image content on twimg.com currently hosted by Akamai and Amazon.",cdn,1494630000000,1636268400000,no,http://twitter.com,
41,Apache,,Apache has been the most popular web server on the Internet since April 1996.,Web Server,1494630000000,1636268400000,no,http://httpd.apache.org/,
42,Avada,['WordPress Theme'],A responsive multi-purpose theme.,framework,1494630000000,1636268400000,maybe,http://themeforest.net/item/avada-responsive-multipurpose-theme/2833226?ref=garazy,
43,WordPress,"['Open Source', 'Blog']","WordPress is a state-of-the-art semantic personal publishing platform with a focus on aesthetics, web standards, and usability.",cms,1494630000000,1636268400000,no,http://wordpress.org,
44,Facebook for Websites,,Allows a user to make a website more sociable and connected with integrations from the hugely popular Facebook website.,javascript,1494630000000,1636268400000,no,http://developers.facebook.com/,
45,Contact Form 7,['Feedback Forms and Surveys'],"Specifically designed for wordpress blogs. Contact Form 7 can manage multiple contact forms, plus you can customize the form and the mail contents flexibly with simple markup.",widgets,1494630000000,1635231600000,no,http://wordpress.org/extend/plugins/contact-form-7/,
46,GStatic Google Static Content,,Google has off-loaded static content (Javascript/Images/CSS) to a different domain name in an effort to reduce bandwidth usage and increase network performance for the end user.,cdn,1494630000000,1587423600000,no,https://google.com,
47,IPhone / Mobile Compatible,,The website contains code that allows the page to support IPhone / Mobile Content.,mobile,1494630000000,1636268400000,no,http://apple.com,
48,Viewport Meta,,This page uses the viewport meta tag which means the content may be optimized for mobile content.,mobile,1494630000000,1636268400000,no,https://developers.google.com/speed/docs/insights/ConfigureViewport,
49,WooCommerce,['Non Platform'],Transforms your WordPress website into an online store.,shop,1494630000000,1494975600000,no,https://woocommerce.com,
50,Sitelinks Search Box,['Site Search'],"With Google sitelinks search box, people can reach your content more quickly from search results.",widgets,1494630000000,1636268400000,no,https://developers.google.com/webmasters/richsnippets/sitelinkssearch?utm_source=wmc-blog&utm_medium=direct-referral&utm_campaign=sitelinks-searchbox,
51,Cookie Notice,['Privacy Compliance'],Cookie notice lets you inform users that your sites comply with EU law.,widgets,1494630000000,1538694000000,no,https://wordpress.org/plugins/cookie-notice/,
52,AJAX Libraries API,,"The AJAX Libraries API is a content distribution network and loading architecture for the most popular, open source JavaScript libraries.",cdn,1494630000000,1568761200000,no,http://code.google.com/apis/ajaxlibs/documentation/,
53,Lightbox,,"Lightbox JS is a simple, unobtrusive script used to overlay images on the current page. It's a snap to setup and works on all modern browsers.",javascript,1494630000000,1636268400000,no,http://www.huddletogether.com/projects/lightbox/,
54,Matomo,"['Audience Measurement', 'Conversion Optimization', 'Site Optimization']","Matomo is an open source web analytics software. It gives interesting reports on your website visitors, your popular pages, the search engines keywords they used, the language they speak and so much more. Previously known as Piwik Web Analytics.",analytics,1494630000000,1528758000000,no,http://matomo.org,
55,Explorer Canvas,,HTML5 Canvas for Internet Explorer,javascript,1494630000000,1494975600000,no,http://code.google.com/p/explorercanvas/,
56,FitVids.JS,['jQuery Plugin'],"A lightweight, easy-to-use jQuery plugin for fluid width video embeds.",javascript,1495234800000,1636268400000,no,http://fitvidsjs.com/,
57,jQuery Mousewheel,['jQuery Plugin'],Adds mouse wheel support to the web site.,javascript,1495234800000,1636268400000,no,http://plugins.jquery.com/project/mousewheel,jQuery
58,Infinite Scroll,['jQuery Plugin'],jQuery plugin for infinite scrolling.,javascript,1495234800000,1636268400000,no,https://github.com/paulirish/infinite-scroll,
59,Modernizr,['Compatibility'],Modernizr allows you to target specific browser functionality in your stylesheet.,javascript,1495234800000,1636268400000,no,http://www.modernizr.com,
60,jQuery Countdown,['jQuery Plugin'],A jQuery plugin that sets a div or span to show a countdown to a given time.,javascript,1495234800000,1636268400000,no,http://keith-wood.name/countdown.html,jQuery
61,jQuery Cycle,['jQuery Plugin'],A slideshow plugin for JQuery that supports many different types of transition effects.,javascript,1495234800000,1636268400000,no,http://jquery.malsup.com/cycle/,jQuery
62,carouFredSel,"['jQuery Plugin', 'Slider']",jQuery.carouFredSel is a plugin that turns any kind of HTML element into a carousel.,javascript,1495234800000,1636268400000,no,http://caroufredsel.dev7studios.com/,
63,jQuery Easing,"['Animation', 'jQuery Plugin']","A jQuery extension that provides functionality to ""ease"" things onto or off of the screen.",javascript,1495234800000,1636268400000,no,http://gsgd.co.uk/sandbox/jquery/easing/,jQuery
64,FlexSlider,"['jQuery Plugin', 'Slider']",jQuery Slider toolkit from Woothemes.,javascript,1495234800000,1636268400000,no,http://www.woothemes.com/flexslider,
65,Hover Intent,['UI'],"hoverIntent is a plug-in that attempts to determine the user's intent. It works like (and was derived from) jQuery's built-in hover. However, instead of immediately calling the onMouseOver function, it waits until the user's mouse slows down enough before making the call.",javascript,1495234800000,1636268400000,no,http://cherne.net/brian/resources/jquery.hoverIntent.html,
66,jQuery Placeholder,['jQuery Plugin'],The jQuery placeholder easily allows you to emulate the placeholder attribute on input fields for all browsers.,javascript,1495234800000,1636268400000,no,https://github.com/mathiasbynens/jquery-placeholder,jQuery
67,touchSwipe,"['Compatibility', 'jQuery Plugin']","TouchSwipe is a jquery plugin to be used with jQuery on touch input devices such as iPad, iPhone etc.",javascript,1495234800000,1636268400000,no,https://github.com/mattbryson/TouchSwipe-Jquery-Plugin,
68,SSL by Default,,The website redirects traffic to an HTTPS/SSL version by default.,ssl,1494975600000,1636268400000,no,http://trends.builtwith.com/ssl,
69,WooCommerce Checkout,"['Open Source', 'Plugin / Module']",A WooCommerce website that has a checkout page.,shop,1494975600000,1494975600000,no,http://woocommerce.com,
70,YouTube,"['Live Stream / Webcast', 'Online Video Platform', 'Social Video Platform']",Embedded videos from YouTube.,media,1495753200000,1587942000000,no,http://youtube.com,
71,German,,Website content is written in German.,language,1496358000000,1636268400000,no,http://de.wikipedia.org,
72,Wordpress Daily Activity,,The WordPress site has new blog activity on a daily interval.,cms,1496530800000,1527894000000,no,http://wordpress.com,WordPress
73,DoubleClick.Net,,"DoubleClick enables agencies, marketers and publishers to work together successfully and profit from their digital marketing investments.",ads,1498604400000,1545346800000,no,http://www.doubleclick.com,
74,Google Maps API,,Google Maps has a wide array of APIs that let you embed the functionality of Google Maps.,mapping,1500591600000,1631862000000,no,https://developers.google.com/maps/,
75,Google Maps,['Maps'],Google maps embedded into the webpage.,mapping,1500591600000,1631862000000,no,http://www.google.com/apis/maps/,
76,Google Webmaster,,Webmaster tools provide you with a free and easy way to make your site more Google-friendly.,Web Master,1503010800000,1636268400000,no,http://www.google.com/webmasters/,
77,The Events Calendar,"['Bookings', 'WordPress Plugins']",The Events Calendar is an extensible plugin that lets you easily share your events.,widgets,1503356400000,1636268400000,no,http://wordpress.org/plugins/the-events-calendar/,
78,Packery,['UI'],Packery is a JavaScript layout library that uses a bin-packing algorithm.,javascript,1504306800000,1635404400000,no,http://packery.metafizzy.co/,
79,Ninja Popups for WordPress,['WordPress Plugins'],Pop ups to convert visitors to subscribers.,widgets,1505170800000,1636268400000,no,http://codecanyon.net/item/ninja-popups-for-wordpress/3476479?ref=garazy,
80,Fancybox,,"FancyBox is a tool for displaying images, html content and multi-media in a Mac-style ""lightbox"" that floats overtop of web page. ",javascript,1505170800000,1634540400000,no,http://fancybox.net/,
81,imagesLoaded,,jQuery plugin for seeing if the images are loaded.,javascript,1506034800000,1636268400000,no,https://github.com/desandro/imagesloaded,
82,Yoast Plugins,['WordPress Plugins'],SEO based plugins from Yoast.,widgets,1507244400000,1586214000000,no,http://yoast.com/wordpress/seo/,
83,Yoast WordPress SEO Plugin,['WordPress Plugins'],"Functionality that helps you optimize your pages content, images titles, meta descriptions and more.",widgets,1507244400000,1636268400000,no,https://yoast.com/wordpress/plugins/seo/,Yoast Plugins
84,Google Maps for Work,,Google Maps for work.,mapping,1507244400000,1559689200000,no,https://www.google.com/work/mapsearth/,Google Maps
85,Euro,['Currency'],The website uses the € symbol on its website - meaning it may accept payment in Euros.,payment,1507244400000,1636268400000,no,https://en.wikipedia.org/wiki/Euro,
86,Yoast SEO Premium,['WordPress Plugins'],Premium version of the Yoast WordPress Plugin.,widgets,1507244400000,1586214000000,yes,https://yoast.com/wordpress/plugins/seo-premium/,Yoast WordPress SEO Plugin
87,Shutterstock,['Image Provider'],Images on this website may have been sourced from Shutterstock.,widgets,1519340400000,1546556400000,no,http://shutterstock.com,
88,Content Delivery Network,,This page contains links that give the impression that some of the site contents are stored on a content delivery network.,CDN,1519858800000,1635231600000,no,http://en.wikipedia.org/wiki/Content_Delivery_Network,
89,Isotope,,A jQuery plugin for magical layouts,javascript,1519858800000,1568761200000,no,http://isotope.metafizzy.co,
90,Bootstrap.js,['JavaScript Library'],Twitter Bootstrap JS components.,javascript,1519858800000,1589410800000,no,https://getbootstrap.com/javascript/,
91,Copyright Year 2017,,Webpage has a copyright year of 2017 with no detectable mention of the current year.,copyright,1519858800000,1529967600000,no,https://en.wikipedia.org/wiki/Copyright,
92,Workplace by Facebook,,"Group discussion, a personalised News Feed, and voice and video calling from Facebook.",widgets,1519858800000,1534806000000,no,https://workplace.fb.com/,
93,Adobe Connect,,"Adobe Connect web conferencing software offers online meeting functionality, virtual classrooms and large scale webinars.",widgets,1519858800000,1592262000000,maybe,http://www.adobe.com/products/adobeconnect.html,
94,Detect Mobile Browsers,['Compatibility'],Open source mobile phone detection.,javascript,1526943600000,1551999600000,no,http://detectmobilebrowsers.com/,
95,YouTube IFrame API,,The IFrame player API lets you embed a YouTube video player on your website and control the player using JavaScript,media,1527462000000,1635231600000,no,https://developers.google.com/youtube/iframe_api_reference,
96,YouTube IFrame Upload,,Lets users upload videos to YouTube from any webpage.,widgets,1527462000000,1635231600000,no,http://developers.google.com/youtube/youtube_upload_widget,
97,Amplitude,['Mobile'],Mobile analytics platform.,analytics,1527462000000,1527462000000,maybe,https://amplitude.com/,
98,Download Monitor,['WordPress Plugins'],Pluging for managing upload and download of files on a WordPress blog.,widgets,1529017200000,1589583600000,no,http://wordpress.org/plugins/download-monitor/,
99,jQuery UI,"['jQuery Plugin', 'UI']","jQuery UI provides abstractions for low-level interaction and animation, advanced effects and high-level, themeable widgets, built on top of the jQuery JavaScript Library, that you can use to build highly interactive web applications.",javascript,1534806000000,1635231600000,no,http://jqueryui.com/,jQuery
100,WP PostRatings,['WordPress Plugins'],Widget that allows rating of WordPress blog posts.,widgets,1534806000000,1636268400000,no,http://wordpress.org/plugins/wp-postratings,
101,Moment JS,['JavaScript Library'],"moment.js is a date library for parsing, validating, manipulating, and formatting dates.",javascript,1534806000000,1552863600000,no,http://momentjs.com,
102,Advanced Responsive Video Embedder,['WordPress Plugins'],Multi provider video embedding tool.,widgets,1535670000000,1636268400000,no,https://wordpress.org/plugins/advanced-responsive-video-embedder/,
103,Issuu,,"Collect, share and publish in a format designed to make your documents look their very best.",widgets,1536620400000,1568761200000,no,http://issuu.com/,
104,PHP,,PHP is a widely used general-purpose scripting language that is especially suited for Web development and can be embedded into HTML.,framework,1537830000000,1633158000000,no,http://www.php.net,
105,Amazon SSL,,Amazon supplied SSL certificate,ssl,1547766000000,1636268400000,no,https://amazon.com,
106,PayPal Form,['Payments Processor'],The website contains a form for paying with PayPal.,payment,1549148400000,1634540400000,no,http://paypal.com,
107,PayPal,['Payment Acceptance'],The website accepts payments with PayPal.,payment,1549234800000,1635404400000,no,http://paypal.com,
108,ThemeFusion,['WordPress Plugins'],Visual drag and drop plugin for Avada.,widgets,1551049200000,1636268400000,maybe,https://theme-fusion.com,
109,lazySizes,,"Lazy loader for images (responsive and normal), iframes and scripts, that detects any visibility changes triggered through user interaction, CSS or JavaScript without configuration.",javascript,1553209200000,1636268400000,no,http://github.com/aFarkas/lazysizes,
110,Amazon CloudFront,['Edge Delivery Network'],Amazon CloudFront delivers your static and streaming content using a global network of edge locations.,cdns,1553209200000,1636268400000,yes,http://aws.amazon.com/cloudfront/,
111,OneSignal,['Push Notifications'],Push notification delivery solution.,widgets,1553727600000,1570575600000,maybe,http://onesignal.com,
112,Pound Sterling,['Currency'],The website uses the £ symbol on its website - meaning it may accept payment in this British currency.,payment,1559689200000,1615104000000,no,https://en.wikipedia.org/wiki/Pound_sign,
113,Impressum,,This page has a link to an 'Impressum' page which is required under German law for German websites.,link,1559689200000,1636268400000,no,https://kb.builtwith.com/special-reports/link-tracking/,
114,Borlabs Cookie,"['Privacy Compliance', 'WordPress Plugins']",GDPR solution for Wordpress.,widgets,1572822000000,1636268400000,no,https://borlabs.io,
115,Pixabay,['Image Provider'],Free image provider.,widgets,1573426800000,1636268400000,no,https://pixabay.com,
116,WebEx Panel,,WebEx system.,widgets,1591052400000,1592262000000,no,http://webex.com,
117,Some Robots Disallow,,Blocks some but not all robots from indexing the website.,robots,1593644400000,1636268400000,no,https://robotstxt.org,
118,Chart.js,['Charting'],JavaScript charting for designers & developers.,javascript,1591052400000,1633158000000,no,http://www.chartjs.org/,
119,jQuery Migrate,['Compatibility'],APIs and features removed from jQuery core,javascript,1591052400000,1633158000000,no,https://github.com/jquery/jquery-migrate,jQuery
120,Gravity Forms,['Feedback Forms and Surveys'],Contact Forms for WordPress.,widgets,1599030000000,1636268400000,yes,http://www.gravityforms.com/,
121,LogMeIn,,Access and manage computers remotely and provider support.,widgets,1600383600000,1636268400000,maybe,https://logmein.com,
122,COVID-19,,This website mentions COVID-19 / Novel Coronavirus.,widgets,1600383600000,1633417200000,no,https://www.who.int/emergencies/diseases/novel-coronavirus-2019,
123,Google Apps for Business,['Business Email Hosting'],"Web-based email, calendar, and documents for teams. Renamed to Google Apps for Work, but now known as G Suite from Google Cloud.",mx,1606518000000,1635231600000,no,http://www.google.com/a,
124,Choices,['WordPress Theme'],Responsive Business and Portfolio,framework,1612252800000,1633158000000,no,http://themeforest.net/item/choices-responsive-business-and-portfolio/2536338?ref=garazy,
125,Visa,['Payment Acceptance'],The website accepts payments with Visa.,payment,1615536000000,1615964400000,no,http://visa.com,
126,Popper.js,,A library to manage your pop ups.,javascript,1620342000000,1636268400000,no,https://popper.js.org/,
127,DataTables,['jQuery Plugin'],jQuery plugin to extend tables.,javascript,1620342000000,1636268400000,no,http://datatables.net/,
128,Adobe Dreamweaver,,"Based on the use of certain javascript functions, this page contains code generated, at least initially, by Dreamweaver.",framework,1102978800000,1380236400000,no,http://www.adobe.com/products/dreamweaver,
129,GlobalSign,['Root Authority'],Certificate provided by GlobalSign.,ssl,1629702000000,1634540400000,no,http://globalsign.com,
