,Name,Categories,Description,Tag,FirstDetected,LastDetected,IsPremium,Link,Parent
145,Zemanta,['Content Modification'],"Zemanta is a tool that looks over your shoulder while you blog and gives you tips and advice, suggests related content and pictures and makes sure your posts get promoted as they deserve to be.",widgets,1602572400000,1602572400000,no,http://www.zemanta.com/,
146,YouTube Privacy Enchanced,,Contains YouTube no cookie content.,media,1412546400000,1636444800000,no,https://youtube.com,
147,jQuery Cookie,['jQuery Plugin'],"A simple, lightweight jQuery plugin for reading, writing and deleting cookies.",javascript,1607846400000,1636444800000,no,https://github.com/carhartl/jquery-cookie,jQuery
148,DigiCert SSL,['Root Authority'],Certificate provided by DigiCert.,ssl,1608364800000,1632121200000,no,http://www.digicert.com/,
149,Thawte SSL,['Root Authority'],Certificated provided by Thawte.,ssl,1608364800000,1632121200000,no,http://thawte.com,
150,SSL by Default,,The website redirects traffic to an HTTPS/SSL version by default.,ssl,1608678000000,1636444800000,no,http://trends.builtwith.com/ssl,
151,Maestro,['Payment Acceptance'],The website accepts payments with Maestro.,payment,1611702000000,1611702000000,no,https://brand.mastercard.com/brandcenter/more-about-our-brands.html,
152,Amazon SES,['Transactional Email'],"Amazon Simple Email Service (Amazon SES) is a  scalable, bulk, transactional email-sending service for businesses and developers.",mx,1613257200000,1636444800000,yes,http://aws.amazon.com/ses/,
153,Qubit,['Personalization'],Persuasive personalization for eCommerce.,analytics,1443823200000,1636444800000,yes,https://qubit.com,
154,Adobe Dreamweaver,,"Based on the use of certain javascript functions, this page contains code generated, at least initially, by Dreamweaver.",framework,1017270000000,1159912800000,no,http://www.adobe.com/products/dreamweaver,
155,SWFObject,,SWFObject is a small Javascript file used for embedding Adobe Flash content. The script can detect the Flash plug-in in all major web browsers (on Mac and PC) and is designed to make embedding Flash movies as easy as possible.,javascript,1191276000000,1232924400000,no,http://blog.deconcept.com/swfobject/,
156,jQuery Flash,['jQuery Plugin'],A jQuery plugin for embedding Flash movies.,javascript,1256598000000,1388876400000,no,http://jquery.lukelutman.com/plugins/flash/,jQuery
157,SimpleModal,,SimpleModal is a lightweight jQuery Plugin which provides a powerful interface for modal dialog development.,javascript,1256598000000,1388876400000,no,http://www.ericmmartin.com/projects/simplemodal/,
158,Fancybox,,"FancyBox is a tool for displaying images, html content and multi-media in a Mac-style ""lightbox"" that floats overtop of web page. ",javascript,1256598000000,1388876400000,no,http://fancybox.net/,
159,JCarousel,"['jQuery Plugin', 'Slider']",jCarousel is a jQuery plugin for controlling a list of items in horizontal or vertical order.,javascript,1256598000000,1388876400000,no,http://sorgalla.com/jcarousel/,
160,jQuery NoConflict,['jQuery Plugin'],Return control of $ back to the other libraries with a call to $.noConflict().,javascript,1256598000000,1388876400000,no,http://api.jquery.com/jQuery.noConflict/,jQuery
161,Facebook Badge,,Displays your Facebook profile information on the page using an older version of Facebook button known as Facebook Badge.,widgets,1317420000000,1388876400000,no,http://facebook.com,
162,Facebook Like Button,,The code to implement a Facebook Like Button on the page.,widgets,1317420000000,1388876400000,no,http://developers.facebook.com/docs/reference/plugins/like/,
163,Twitter Widget,,"Adds twitter to the website, this includes the user of a twitter badge, blogger JavaScript or anything from widgets.twimg.com.",widgets,1317420000000,1388876400000,no,http://twitter.com,
164,Twitter CDN,,"This page contains content sourced from the Twitter CDN, either by the use of Widgets or linking to image content on twimg.com currently hosted by Akamai and Amazon.",cdn,1317420000000,1635231600000,no,http://twitter.com,
