,Name,Categories,Description,Tag,FirstDetected,LastDetected,IsPremium,Link,Parent
0,reCAPTCHA,['CAPTCHA'],Anti-bot CAPTCHA widget from Google.,widgets,1443823200000,1555023600000,no,https://www.google.com/recaptcha/intro/index.html,
1,Weborama,,Ad marketing and behavioral targeting solution.,ads,1443823200000,1606809600000,no,http://weborama.com,
2,AppNexus,"['Ad Exchange', 'Demand-side Platform']","Provides access to the major exchanges and aggregators, as well as cloud infrastructure scalable to billions of ad impressions a day with a layer of real-time decisioning on top.",ads,1443823200000,1636444800000,no,http://www.appnexus.com/,
3,QuBit OpenTag,['Tag Management'],Qubit Opentag is a flexible enterprise tag manager allowing developers to take complete control of their digital marketing & analytics tags.,widgets,1443823200000,1636444800000,maybe,http://www.qubitproducts.com/tag-management,Qubit
4,jQuery Once,['jQuery Plugin'],Filters out all elements that had the same filter applied on them before. ,javascript,1412546400000,1636444800000,no,http://plugins.jquery.com/once/,jQuery
5,acens Technologies,"['Cloud Hosting', 'Spanish hosting']",acens Technologies provides cloud services and is based in Spain.,hosting,1458169200000,1508281200000,no,http://acens.com,
6,MediaMath,['Advertiser Tracking'],Tools that enable and empower marketing professionals.,analytics,1443823200000,1606809600000,no,http://mediamath.com,
7,Touchwipe,"['Compatibility', 'jQuery Plugin']","Obtain the wipe event on an iPhone, iPad or iPod Touch.",javascript,1443823200000,1508799600000,no,http://www.netcu.de/jquery-touchwipe-iphone-ipad-library,
8,jqTransform,,A jQuery styling plugin which allows you to skin form elements.,javascript,1443823200000,1508799600000,no,http://www.dfc-e.com/metiers/multimedia/opensource/jqtransform/,
9,jQuery Easing,"['Animation', 'jQuery Plugin']","A jQuery extension that provides functionality to ""ease"" things onto or off of the screen.",javascript,1443823200000,1508799600000,no,http://gsgd.co.uk/sandbox/jquery/easing/,jQuery
10,Drupal,['Open Source'],An engine suitable to setup or build a content driven or community driven website. Modular design allows flexibility in design.,cms,1412546400000,1636444800000,no,http://www.drupal.org,
11,Facebook Domain Insights,['Social Management'],This website contains tracking information that allows admins to see Facebook Insights out of Facebook to this domain.,analytics,1349042400000,1636444800000,no,http://www.facebook.com/insights/,
12,eXelate,,The first and largest open marketplace for behavioral targeting data.,ads,1458169200000,1602572400000,no,http://www.exelate.com,
13,jQuery,['JavaScript Library'],"JQuery is a fast, concise, JavaScript Library that simplifies how you traverse HTML documents, handle events, perform animations, and add Ajax interactions to your web pages. jQuery is designed to change the way that you write JavaScript.",javascript,1256598000000,1636444800000,no,http://jquery.com,jQuery
14,RadiumOne,"['Audience Targeting', 'Multi-Channel']",Dynamic audience platform for social advertising.,ads,1458169200000,1506380400000,yes,http://radiumone.com,
15,jQuery Colorbox,['jQuery Plugin'],"A light-weight, customizable lightbox plugin for jQuery.",javascript,1443823200000,1636268400000,no,http://colorpowered.com/colorbox/,jQuery
16,bxSlider,"['jQuery Plugin', 'Slider', 'UI']",Response jQuery Content Slider,javascript,1412546400000,1636444800000,no,http://bxslider.com/,
17,Yahoo Web Analytics,['Audience Measurement'],Yahoo! Web Analytics is an enterprise site analytics tool that provides real-time insight into visitor behavior on your website.,analytics,1458169200000,1602572400000,no,http://web.analytics.yahoo.com,
18,Akamai,,Akamai provides a distributed computing platform for global Internet content and application delivery.,cdn,1038092400000,1542063600000,no,http://akamai.com,
19,DoubleClick.Net,,"DoubleClick enables agencies, marketers and publishers to work together successfully and profit from their digital marketing investments.",ads,1458169200000,1608451200000,no,http://www.doubleclick.com,
20,Drupal 7,,Version 7 of Drupal.,cms,1458169200000,1507849200000,no,http://www.drupal.org/drupal-7.0,Drupal
21,161Media,,Audience advertising solution platform.,ads,1458169200000,1488236400000,no,http://www.clickdistrict.com,
22,Tube Mogul,,"TubeMogul is a free service that provides a single point for deploying uploads to the top video sharing sites, and powerful analytics on who, what, and how videos are being viewed.
",media,1458169200000,1485385200000,no,http://tubemogul.com,
23,Rapleaf,['Marketing Automation'],Marketing automation tools with the necessary data to help brands keep their customers engaged. Now TowerData.,analytics,1458169200000,1602572400000,yes,http://www.rapleaf.com,
24,SPF,,The Sender Policy Framework is an open standard specifying a technical method to prevent sender address forgery.,mx,1458169200000,1636444800000,no,http://www.openspf.org/,
25,Rubicon Project,,Advertising optimization service.,ads,1458169200000,1570921200000,no,http://rubiconproject.com,
26,Adform,,"Adform provide media planning, buying, optimization, and reporting for all online display advertising.",ads,1458169200000,1508281200000,no,http://www.adform.com,
27,Modernizr,['Compatibility'],Modernizr allows you to target specific browser functionality in your stylesheet.,javascript,1412546400000,1636444800000,no,http://www.modernizr.com,
28,Google Font API,['Fonts'],The Google Font API helps you add web fonts to any web page.,widgets,1458169200000,1636268400000,no,https://fonts.google.com,
29,AppNexus Segment Pixel,,An AppNexus Segment Pixel.,ads,1443823200000,1636444800000,no,http://appnexus.com,AppNexus
30,YouTube,"['Live Stream / Webcast', 'Online Video Platform', 'Social Video Platform']",Embedded videos from YouTube.,media,1412546400000,1636444800000,no,http://youtube.com,
31,Apache,,Apache has been the most popular web server on the Internet since April 1996.,Web Server,1458169200000,1507849200000,no,http://httpd.apache.org/,
32,CloudFront,,"Amazon CloudFront is a web service for content delivery. It integrates with other Amazon Web Services to give developers and businesses an easy way to distribute content to end users with low latency, high data transfer speeds, and no commitments.",cdn,1443823200000,1636444800000,no,http://aws.amazon.com/cloudfront/,
33,Videology,,Video advertising technology that works across all video screens to connect brands with those consumers they most want to reach. Previously known as TidalTV.,ads,1458169200000,1506380400000,no,http://www.videologygroup.com,
34,Google Analytics,"['Application Performance', 'Audience Measurement', 'Visitor Count Tracking']",Google Analytics offers a host of compelling features and benefits for everyone from senior executives and advertising and marketing professionals to site owners and content developers.,analytics,1159912800000,1636444800000,no,http://google.com/analytics,
35,jQuery Mousewheel,['jQuery Plugin'],Adds mouse wheel support to the web site.,javascript,1443823200000,1508799600000,no,http://plugins.jquery.com/project/mousewheel,jQuery
36,Respond,['Compatibility'],"A fast & lightweight polyfill for min/max-width CSS3 Media Queries (for IE 6-8, and more)",javascript,1458169200000,1636268400000,no,https://github.com/scottjehl/Respond,
37,Google Universal Analytics,,"The analytics.js JavaScript snippet is a new way to measure how users interact with your website. It is similar to the previous Google tracking code, ga.js, but offers more flexibility for developers to customize their implementations.",analytics,1412546400000,1636444800000,no,https://developers.google.com/analytics/devguides/collection/analyticsjs/,Google Analytics
38,FlexSlider,"['jQuery Plugin', 'Slider']",jQuery Slider toolkit from Woothemes.,javascript,1412546400000,1636444800000,no,http://www.woothemes.com/flexslider,
39,Modernizr 2.0,,Modernizr version 2.0.*,javascript,1412546400000,1636444800000,no,http://modernizr.com/news/modernizr-2/,Modernizr
40,IponWeb BidSwitch,"['Ad Exchange', 'Fraud Prevention']","BidSwitch facilitates both Supply and Demand technology partners to efficiently and transparently connect, trade and manage multiple RTB partners.",ads,1458169200000,1570921200000,no,http://bidswitch.com,
41,Viewport Meta,,This page uses the viewport meta tag which means the content may be optimized for mobile content.,mobile,1412546400000,1636444800000,no,https://developers.google.com/speed/docs/insights/ConfigureViewport,
42,TidalTV,['Online Video Platform'],TidalTV is a broadband TV platform.,media,1458169200000,1506380400000,no,http://www.videologygroup.com,
43,matchMedia,['Compatibility'],matchMedia polyfill for testing media queries in JS.,javascript,1458169200000,1588201200000,no,http://github.com/paulirish/matchMedia.js/,
44,BrightRoll,['Ad Network'],Enabling agencies and brand advertisers to execute smart video ad campaigns across the industry’s leading publishers.,ads,1463007600000,1520290800000,no,http://www.brightroll.com/,
45,Datalogix,"['Advertiser Tracking', 'Conversion Optimization']",Leverages the power of purchase-based audience targeting to drive measurable online and offline sales,analytics,1463007600000,1548543600000,no,http://datalogix.com,
46,Kauli,,Inventory management exchange from Japan.,ads,1463007600000,1490050800000,no,http://kauli.co.jp/,
47,StickyAds TV,['Digital Video Ads'],Video ad platform for publishers.,ads,1463007600000,1570921200000,no,http://stickyads.tv,
48,Facebook Exchange FBX,['Ad Exchange'],Facebook Exchange (FBX) is a real-time bidded ad serving protocol.,ads,1463007600000,1476140400000,no,https://developers.facebook.com/docs/reference/ads-api/rtb/,
49,ContextWeb,"['Ad Analytics', 'Ad Network']","ContextWeb, Inc. provides high-precision, real-time contextual advertising solutions guaranteed to maximize the results and impact of online advertising. Now known as PulsePoint.",ads,1463007600000,1560380400000,no,http://contextweb.com,
50,Neustar AdAdvisor,,Neustar AdAdvisor provides data to online marketers and websites to help them improve their ability to deliver content and advertising to consumers.,ads,1463007600000,1476140400000,no,http://www.adadvisor.net/,
51,Openads/OpenX,['Ad Server'],"Openads offer ad serving software that is simple, reliable and totally independent. Best of all, it's free!",ads,1463007600000,1570921200000,no,http://openads.org,
52,Yahoo Small Business,,Yahoo advertising network and search engine marketing solutions.,ads,1463007600000,1525734000000,no,http://sem.smallbusiness.yahoo.com/searchenginemarketing/,
53,Switch Ads,,UK based advertising system.,ads,1463007600000,1525734000000,no,http://switchads.com,
54,Geniee,,Advertising network solution from Japan.,ads,1463007600000,1564182000000,no,http://geniee.co.jp/,
55,Krux Digital,['Advertiser Tracking'],"Captures, connects and monetize consumer data.",analytics,1463007600000,1570921200000,yes,http://kruxdigital.com/,
56,Pubmatic,['Dynamic Creative Optimization'],PubMatic Enables Ad Optimization Across Every Ad Network,ads,1463007600000,1570921200000,no,http://pubmatic.com,
57,Aggregate Knowledge,,Data management solution that combines both media and audience data.,ads,1463007600000,1525734000000,no,http://www.aggregateknowledge.com,
58,Burst Media,['Ad Network'],Internet advertising network representing specialty-content web sites.,ads,1463007600000,1485385200000,no,http://burstmedia.com,
59,BlueKai DMP,['Data Management Platform'],BlueKai sites that specifically call a tags script.,ads,1463007600000,1570921200000,no,http://bluekai.com,BlueKai
60,Semasio,,User Intelligence Platform advertising solution.,ads,1463007600000,1563663600000,no,http://semasio.com/,
61,Sonobi,,Digital advertising marketplace tools.,ads,1463007600000,1570921200000,no,http://sonobi.com,
62,Resonate Insights,,Resonate Insights drives media plans that ensure messages reach the right people at the right time,ads,1463007600000,1485385200000,no,http://www.resonateinsights.com/,
63,SpotXchange,,Video ad inventory advertising network.,ads,1463007600000,1570921200000,no,http://www.spotxchange.com/,
64,Index Exchange,,Index Exchange is the world's fastest growing provider of online media solutions. With a network reach of over half the US digital audience. Previously known as Casale Media.,ads,1463007600000,1570921200000,no,http://casalemedia.com,
65,Criteo,['Retargeting / Remarketing'],Behavioural targeting for e-commerce customers.,ads,1463007600000,1602572400000,no,http://criteo.com,
66,Improve Digital,['Ad Exchange'],Private ad exchange network.,ads,1463007600000,1564182000000,no,http://www.improvedigital.com,
67,BlueKai,['Ad Exchange'],The BlueKai Data Exchange enables partners to buy and own data to boost ad targeting across any media.,ads,1463007600000,1570921200000,no,http://bluekai.com,
68,Lijit Widget,,Contains widgets by lijit providing revolutionary search tools and stats for your blog.,widgets,1463007600000,1570921200000,no,http://lijit.com,
69,Advertising.com,"['Ad Analytics', 'Ad Exchange', 'Ad Network']","Ad.com network reaches nearly 85% of all Internet users in the U.S., making us the biggest ad network in town - from Verizon Media.",ads,1463007600000,1570921200000,no,http://advertising.com,
70,Adap.TV,,Video monetization service.,ads,1463007600000,1488236400000,no,http://adap.tv,
71,adingo,['Affiliate Programs'],Japanese based internet media traffic monetization solution. Also known as Fluct.,ads,1463007600000,1564182000000,no,http://adingo.jp,
72,Smartclip,['Digital Video Ads'],Multiscreen video and brand advertising platform.,ads,1463007600000,1525734000000,no,http://smartclip.com/,
73,Media Innovation Group,,"Provides marketing communicators with a single access point to every digital audience, and the technology platform to engage with users.",ads,1463007600000,1500332400000,no,http://www.themig.com,
74,Mobile Non Scaleable Content,,"This content is formatted for mobile devices, it does not allow the content to be scaled.",mobile,1465945200000,1591138800000,no,http://developer.apple.com/library/safari/#documentation/appleapplications/reference/SafariHTMLRef/Articles/MetaTags.html,
75,AJAX Libraries API,,"The AJAX Libraries API is a content distribution network and loading architecture for the most popular, open source JavaScript libraries.",cdn,1465945200000,1466722800000,no,http://code.google.com/apis/ajaxlibs/documentation/,
76,Google Hosted Libraries,,"Google Hosted Libraries is a globally available content distribution network for the most popular, open-source JavaScript libraries.",javascript,1465945200000,1466722800000,no,https://developers.google.com/speed/libraries/,
77,Google Hosted jQuery,,jQuery hoted at Google.,javascript,1465945200000,1466722800000,no,https://developers.google.com/speed/libraries/,Google Hosted Libraries
78,Shockwave Flash Embed,,Adobe Flash Macromedia shockwave content. End of life product retiring in 2020.,framework,1159912800000,1474412400000,no,http://www.macromedia.com/software/flash/about/,
79,html5shiv,['Compatibility'],HTML5 IE enabling script shim.,javascript,1412546400000,1636444800000,no,https://github.com/afarkas/html5shiv,
80,yepnope,,yepnope is an asynchronous conditional resource loader that allows you to load only the scripts that your users need.,javascript,1466722800000,1466722800000,no,http://yepnopejs.com/,
81,CRM4D,,French based ad on-boarding solution.,ads,1468364400000,1602572400000,no,http://crm4d.com,
82,AdMeta,,Technology provider of Publisher Side Ad Exchange solutions to Premium Publishers.,ads,1468450800000,1520290800000,no,http://admeta.com,
83,Eperflex,,Email retargeting system.,analytics,1468450800000,1506380400000,yes,http://email-reflex.com,
84,Efficiency Network,,French based monetization service.,ads,1468450800000,1506380400000,no,http://effitarget.com,
85,Adscale,,German advertising network.,ads,1468450800000,1563663600000,no,http://www.adscale.de,
86,EasyDMP,,DMP platform from France from Squadata.,ads,1468450800000,1506380400000,no,http://easydmp.net,
87,Ve Interactive,['Conversion Optimization'],Ve Interactive is a data-driven solutions provider for shopping cart merchants.,analytics,1468969200000,1469055600000,yes,http://www.veinteractive.com,
88,Signal,"['Advertiser Tracking', 'Tag Management']",Distributed data management platform helps share data the website creates with other platforms such as advertisers and audience analytics.,analytics,1474498800000,1476140400000,yes,http://brighttag.com,
89,CryptoJS,,CryptoJS is a growing collection of standard and secure cryptographic algorithms implemented in JavaScript using best practices and patterns. ,javascript,1479942000000,1485298800000,no,https://code.google.com/p/crypto-js/,
90,The Trade Desk,['Demand-side Platform'],Data-driven marketing suite that offers marketers a single place to buy all forms of online media.,ads,1483570800000,1602572400000,no,http://www.thetradedesk.com,
91,Font Awesome,['Fonts'],Iconic font and CSS toolkit.,widgets,1485385200000,1608451200000,no,http://fontawesome.io,
92,BootstrapCDN,,"Bootstrap CDN system - encompasses MaxCDN, NetDNA and Stackpath - donated to jsDelivr.",cdn,1485385200000,1486767600000,no,http://www.bootstrapcdn.com/,
93,Graphium,,Onboarding CRM solution from France.,ads,1487199600000,1602572400000,no,https://www.graphinium.com/,
94,Fidelity Media,,Fidelity Media advertising network helps deliver your ad message to the right audience.,ads,1488236400000,1488236400000,no,http://fidelity-media.com/,
95,Rocket Fuel,,Unlocks the power of artificial intelligence to make digital advertising better,ads,1488236400000,1498518000000,no,http://rocketfuel.com/,
96,LiveRamp,"['Lead Generation', 'Marketing Automation']",CRM Retargeting & Data Onboarding app.,analytics,1491260400000,1602572400000,yes,http://liveramp.com/,
97,GStatic Google Static Content,,Google has off-loaded static content (Javascript/Images/CSS) to a different domain name in an effort to reduce bandwidth usage and increase network performance for the end user.,cdn,1494025200000,1608278400000,no,https://google.com,
98,Yieldlab,['Multi-Channel'],Digital channel advertising system from Germany.,ads,1494284400000,1494284400000,no,http://yieldlab.de,
99,Media.net,['Contextual Advertising'],"Contextual, user-driven ads network with multiple implementation techniques.",ads,1494284400000,1525734000000,no,http://media.net/,
100,Spanish,,Website content is written in Spanish.,language,1496358000000,1636444800000,no,http://es.wikipedia.org,
101,Lotame Crowd Control,,Data driven marketing advertising program provides social media sites with advance targeting,analytics,1507590000000,1570921200000,no,http://lotame.com,
102,MediaBong,,"Video embedded from MediaBong, a French based company.",media,1507590000000,1508281200000,no,http://www.mediabong.com/,
103,nginx,,nginx [engine x] is a HTTP server and mail proxy server written by Igor Sysoev.,Web Server,1508281200000,1508799600000,no,http://nginx.net/,
104,Twitter Tweet Button,,Official Tweet Button for sharing articles on websites and counting how many times a URL has been shared.,widgets,1507244400000,1636268400000,no,https://twitter.com/about/resources/buttons#tweet,
105,RSS,,"A family of web feed formats used to publish frequently updated content such as blog entries, news headlines or podcasts.",feeds,1136070000000,1635231600000,no,http://en.wikipedia.org/wiki/RSS_(file_format),
106,Facebook Sharer,,Share this page on Facebook using a deprecated sharing syntax.,widgets,1507244400000,1636268400000,no,http://www.facebook.com/facebook-widgets/share.php,
107,ClouDNS,,Free cloud DNS resolution service.,ns,1507244400000,1520982000000,no,http://www.cloudns.net/,
108,Incapsula,['US hosting'],Security performance and CDN optimizer tools,hosting,1510182000000,1520982000000,no,http://incapsula.com,
109,Google Analytics Classic,,Classic Google Analytics - sites that are using non-universal analytics code.,analytics,1159912800000,1587855600000,no,https://developers.google.com/analytics/devguides/collection/gajs/,Google Analytics
110,Adobe Connect,,"Adobe Connect web conferencing software offers online meeting functionality, virtual classrooms and large scale webinars.",widgets,1519858800000,1588201200000,maybe,http://www.adobe.com/products/adobeconnect.html,
111,Content Delivery Network,,This page contains links that give the impression that some of the site contents are stored on a content delivery network.,CDN,1520290800000,1608451200000,no,http://en.wikipedia.org/wiki/Content_Delivery_Network,
112,Cloudflare DNS,,DNS services provided by Cloudflare.,ns,1521586800000,1636444800000,no,http://cloudflare.com,
113,Cloudflare Hosting,"['US hosting', 'Cloud Hosting', 'Cloud PaaS']",Supercharged web hosting service.,hosting,1521586800000,1636444800000,no,http://cloudflare.com,
114,Comodo SSL,['Root Authority'],Certificate provided by Comodo.,ssl,1521586800000,1581030000000,no,http://comodo.com,
115,Comodo PositiveSSL,,Comodo Positive SSL certificate.,ssl,1521586800000,1581030000000,no,http://www.positivessl.com/ssl-certificate-positivessl.php,
116,Cloudflare SSL,,SSL solutions from Cloudflare,ssl,1521586800000,1636444800000,no,http://cloudflare.com,
117,IPv6,,The website has an IPv6 record.,Server,1521586800000,1636444800000,no,http://en.wikipedia.org/wiki/IPv6,
118,IPhone / Mobile Compatible,,The website contains code that allows the page to support IPhone / Mobile Content.,mobile,1412546400000,1636444800000,no,http://apple.com,
119,Cloudflare,,Automatically optimizes the delivery of your web pages so your visitors get the fastest page load times and best performance.,cdn,1527548400000,1636444800000,no,http://www.cloudflare.com/,
120,DemDex,"['Audience Targeting', 'Multi-Channel']","Demdex's turn-key audience management solutions make implementing a dynamic, multi-channel data strategy cost-effective and easy. Now known as Adobe Audience Manager.",ads,1531954800000,1570921200000,no,http://www.demdex.com/,
121,Adobe Audience Manager Sync,,DMP Platform from Adobe Cookie Sync.,ads,1531954800000,1570921200000,no,http://www.adobe.com/au/marketing-cloud/data-management-platform.html,
122,Euro,['Currency'],The website uses the € symbol on its website - meaning it may accept payment in Euros.,payment,1159912800000,1613257200000,no,https://en.wikipedia.org/wiki/Euro,
123,Pound Sterling,['Currency'],The website uses the £ symbol on its website - meaning it may accept payment in this British currency.,payment,1542927600000,1615017600000,no,https://en.wikipedia.org/wiki/Pound_sign,
124,Japanese Yen,['Currency'],The website uses the ¥ symbol on its website - meaning it may accept payment in this Japanese currency.,payment,1542927600000,1615017600000,no,https://en.wikipedia.org/wiki/Japanese_yen,
125,Tapad,,Allows advertisers to engage the same consumer with consistent ads across multiple platforms.,ads,1542927600000,1602572400000,no,http://www.tapad.com/,
126,Cart Functionality,['Non Platform'],The site has a link to a shopping cart which is not categorized under any of the cart technologies we track (custom implementation or not tracked yet).,shop,1544655600000,1629183600000,no,http://builtwith.com/ecommerce,
127,WebEx Panel,,WebEx system.,widgets,1546124400000,1574290800000,no,http://webex.com,
128,Antevenio,['Marketing Automation'],Digital marketing strategy provider.,analytics,1546988400000,1636444800000,yes,https://www.antevenio.com,
129,AddThis,"['Social Sharing', 'Bookmarking']",Widgets that allow visitors to save and promote the site.,widgets,1553209200000,1570921200000,no,http://addthis.com,
130,zepto.js,['Framework'],"Zepto.js is a minimalist JavaScript framework for mobile WebKit browsers, with a jQuery-compatible syntax.",javascript,1555023600000,1555023600000,no,http://zeptojs.com/,
131,reCAPTCHA v2,,v2 of the Google reCAPTCHA system.,widgets,1555023600000,1555023600000,no,https://developers.google.com/recaptcha/docs/display,reCAPTCHA
132,IAB Tech Lab,['Header Bidding'],Pixel sync system previously known as DigiTrust.,ads,1567119600000,1570921200000,no,https://iabtechlab.com,
133,Powerlinks,['Ad Network'],Native advertising platform.,ads,1567119600000,1570921200000,no,http://powerlinks.com,
134,Sharethrough,,Native video advertising platform.,ads,1567119600000,1568934000000,no,http://www.sharethrough.com/,
135,FreeWheel,['Digital Video Ads'],Premium video monetization solutions.,media,1570921200000,1570921200000,no,http://freewheel.tv/,
136,COVID-19,,This website mentions COVID-19 / Novel Coronavirus.,widgets,1586559600000,1626678000000,no,https://www.who.int/emergencies/diseases/novel-coronavirus-2019,
137,PHP,,PHP is a widely used general-purpose scripting language that is especially suited for Web development and can be embedded into HTML.,framework,1591052400000,1633158000000,no,http://www.php.net,
138,Everest Technologies,,Performance testing and channel strategy provider for eCommerce.,analytics,1602572400000,1602572400000,yes,http://everesttech.com/,
139,OTM,,Programmatic ad platform from Russia.,ads,1602572400000,1602572400000,no,https://otm-r.com,
140,Buzzoola,['Digital Video Ads'],Buzzoola powers video ads no matter how big of a budget you have.,ads,1602572400000,1602572400000,no,http://buzzoola.com/,
141,Kost.TV,,Premium video ad system.,ads,1602572400000,1602572400000,no,https://kost.tv,
142,GetIntent,,Video-first programmatic ad platform.,ads,1602572400000,1602572400000,no,http://getintent.com/,
143,Adhigh,,Ad tracking network.,ads,1602572400000,1602572400000,no,http://adhigh.net,
144,1DMP,['Ad Exchange'],RTB network from Russia.,ads,1602572400000,1602572400000,no,http://1dmp.io,
