,Name,Categories,Description,Tag,FirstDetected,LastDetected,IsPremium,Link,Parent
133,W3 Total Cache,,The fastest and most complete WordPress performance optimization plugin.,widgets,1443855600000,1443855600000,no,http://www.w3-edge.com/wordpress-plugins/w3-total-cache/,
134,WordPress 5.8,,WordPress version 5.8.*,cms,1627714800000,1636268400000,no,http://codex.wordpress.org/Version_5.8,WordPress
135,jQuery NoConflict,['jQuery Plugin'],Return control of $ back to the other libraries with a call to $.noConflict().,javascript,1627714800000,1636268400000,no,http://api.jquery.com/jQuery.noConflict/,jQuery
136,Social Intents,"['eCommerce', 'Live Chat', 'Feedback Forms and Surveys']",Tools to convert website visitors into customers.,widgets,1627714800000,1636268400000,yes,http://socialintents.com/,
137,Klarna,"['Checkout Buttons', 'Pay Later', 'Payments Processor']",Klarna Checkout takes the tries to take the hassle out of buying on mobile devices.,payment,1627714800000,1633071600000,no,http://klarna.com,
138,Java EE,,"Java Platform, Enterprise Edition (Java EE) is the industry standard for developing portable, robust, scalable and secure server-side Java applications.",framework,1630566000000,1633158000000,no,http://java.sun.com/javaee/,
139,Intersection Observer,,API that can be used to understand the visibility and position of DOM elements relative to a containing element or to the top-level viewport.,javascript,1633849200000,1636268400000,no,https://www.w3.org/TR/intersection-observer/,
