,Name,Categories,Description,Tag,FirstDetected,LastDetected,IsPremium,Link,Parent
125,Geniee,,Advertising network solution from Japan.,ads,1453766400000,1453852800000,no,http://geniee.co.jp/,
126,X Plus One,['Demand-side Platform'],[x+1] allows marketers to synchronize their messages to consumers across a broad range of channels.,ads,1453766400000,1453852800000,no,http://www.xplusone.com,
127,Pubmatic,['Dynamic Creative Optimization'],PubMatic Enables Ad Optimization Across Every Ad Network,ads,1453766400000,1504393200000,no,http://pubmatic.com,
128,Aggregate Knowledge,,Data management solution that combines both media and audience data.,ads,1453766400000,1453852800000,no,http://www.aggregateknowledge.com,
129,Index Exchange,,Index Exchange is the world's fastest growing provider of online media solutions. With a network reach of over half the US digital audience. Previously known as Casale Media.,ads,1453766400000,1453852800000,no,http://casalemedia.com,
130,Tapad,,Allows advertisers to engage the same consumer with consistent ads across multiple platforms.,ads,1453766400000,1589842800000,no,http://www.tapad.com/,
131,IponWeb BidSwitch,"['Ad Exchange', 'Fraud Prevention']","BidSwitch facilitates both Supply and Demand technology partners to efficiently and transparently connect, trade and manage multiple RTB partners.",ads,1453766400000,1453852800000,no,http://bidswitch.com,
132,YouTube IFrame Upload,,Lets users upload videos to YouTube from any webpage.,widgets,1453852800000,1555023600000,no,http://developers.google.com/youtube/youtube_upload_widget,
133,Facebook Pixel,,Facebook Pixel is Facebooks conversion tracking system for ads on Facebook to websites.,analytics,1461106800000,1607760000000,no,https://www.facebook.com/business/help/952192354843755,
134,RequireJS,,RequireJS is a JavaScript file and module loader.,javascript,1467068400000,1518217200000,no,http://requirejs.org/,
135,Wistia,"['Enterprise', 'Online Video Platform', 'Video Analytics', 'Video Players']","Wistia is a video marketing, sales, and collaboration application.",media,1468450800000,1555023600000,yes,http://wistia.com,
136,Atom,,Atom Syndication Format is an XML language used for web feeds very similar to RSS.,feeds,1468969200000,1628146800000,no,http://en.wikipedia.org/wiki/Atom_%28standard%29,
137,Adobe Marketing Cloud,"['Audience Measurement', 'Marketing Automation']",A complete set of marketing solutions from Adobe.,analytics,1468969200000,1501282800000,yes,http://www.adobe.com/marketing-cloud.html,
138,Reddit,['Social Sharing'],The Reddit voting widget.,widgets,1474671600000,1628146800000,no,http://reddit.com/buttons,
139,Angular JS,,Angular is what HTML would have been if it had been designed for building web applications.,javascript,1474671600000,1628146800000,no,http://www.angularjs.org,
140,Facebook Sharer,,Share this page on Facebook using a deprecated sharing syntax.,widgets,1474671600000,1635058800000,no,http://www.facebook.com/facebook-widgets/share.php,
141,Facebook Graph API,,This site has content that utilizes the Facebook Graph API,javascript,1474671600000,1623567600000,no,http://developers.facebook.com/docs/api,
142,Fastly,['Application Performance'],Real-time Analytics and CDN platform. Analyze your web and server traffic patterns in real-time.,analytics,1474671600000,1636444800000,no,http://fastly.net,
143,Varnish,,Varnish is a web accelerator / reverse proxy caching server.,Web Server,1475535600000,1628233200000,no,http://varnish-software.com/,
144,GlobalSign,['Root Authority'],Certificate provided by GlobalSign.,ssl,1475535600000,1611475200000,no,http://globalsign.com,
145,Fastly SSL,,Fastly real time analytics SSL certificate,ssl,1475535600000,1592262000000,no,http://fastly.com,
146,YouTube IFrame API,,The IFrame player API lets you embed a YouTube video player on your website and control the player using JavaScript,media,1476572400000,1555023600000,no,https://developers.google.com/youtube/iframe_api_reference,
147,Japanese Yen,['Currency'],The website uses the ¥ symbol on its website - meaning it may accept payment in this Japanese currency.,payment,1477436400000,1602457200000,no,https://en.wikipedia.org/wiki/Japanese_yen,
148,Revv,['Donation'],Payments platform used for one tap donations.,payment,1478732400000,1636182000000,no,http://revv.co,
149,Pound Sterling,['Currency'],The website uses the £ symbol on its website - meaning it may accept payment in this British currency.,payment,1481583600000,1602457200000,no,https://en.wikipedia.org/wiki/Pound_sign,
150,DoubleClick Bid Manager,['Demand-side Platform'],Programmatic buying platform.,ads,1489186800000,1586473200000,no,https://www.doubleclickbygoogle.com/solutions/digital-marketing/bid-manager/,
151,Google Identity Platform,['Login'],Google Sign-In is a secure authentication system that enables users to sign in with their Google account.,widgets,1490050800000,1628146800000,no,https://developers.google.com/identity/,
152,SumoMe,,A script toolkit which allows users to install a growing number of apps on their site.,widgets,1490310000000,1501282800000,no,http://sumome.com/,
153,Google Tag Manager,['Tag Management'],Tag management that lets you add and update website tags without changes to underlying website code.,widgets,1495926000000,1636444800000,no,http://google.com/tagmanager,
154,Font Awesome,['Fonts'],Iconic font and CSS toolkit.,widgets,1498345200000,1636444800000,no,http://fontawesome.io,
155,BootstrapCDN,,"Bootstrap CDN system - encompasses MaxCDN, NetDNA and Stackpath - donated to jsDelivr.",cdn,1498345200000,1635058800000,no,http://www.bootstrapcdn.com/,
156,Fastly Hosted,,Hosted at Fastly,hosting,1498431600000,1636444800000,no,http://fastly.net,
157,Google Analytics Enhanced Ecommerce,,Collect enhanced eCommerce data with Google Analytics.,analytics,1498604400000,1609574400000,no,https://developers.google.com/analytics/devguides/collection/analyticsjs/enhanced-ecommerce,Google Analytics
158,jsDelivr,,"A free CDN where Javascript developers can host their files. Encompasses MaxCDN, and BootstrapCDN.",cdn,1501196400000,1636444800000,no,http://www.jsdelivr.com/,
159,iGoDigital,['Conversion Optimization'],Analyzes individual shopper behavior and provides  personalized product recommendations. Now owned by ExactTarget.,analytics,1504479600000,1607760000000,yes,http://www.igodigital.com,
160,ExactTarget,['Multi-Channel'],ExactTarget is a global Software as a Service (SaaS) leader that powers all types of interactive marketing messages.,ads,1504479600000,1607760000000,yes,http://exacttarget.com/,
161,Facebook Signal,,"Journalists use Signal to surface relevant trends, photos, videos and posts from Facebook and Instagram for use in their storytelling and reporting.",analytics,1504479600000,1607760000000,no,https://www.facebook.com/facebookmedia/get-started/signal,
162,Mailgun,['Transactional Email'],"Mailgun is a set of APIs that allow you to send, receive, track and store email effortlessly.",mx,1507244400000,1537138800000,yes,http://www.mailgun.com/,
163,WURFL.io,,Device detection is JavaScript using code from Wurfl.io,framework,1509145200000,1558566000000,no,https://web.wurfl.io/,
164,Optimizely,"['A/B Testing', 'Site Optimization', 'Conversion Optimization', 'Personalization']",Optimizely empowers companies to deliver more relevant and effective digital experiences on websites and mobile through A/B testing and personalization.,analytics,1519167600000,1636182000000,yes,http://www.optimizely.com,
165,Twitter CDN,,"This page contains content sourced from the Twitter CDN, either by the use of Widgets or linking to image content on twimg.com currently hosted by Akamai and Amazon.",cdn,1519167600000,1520982000000,no,http://twitter.com,
166,Facebook for Websites,,Allows a user to make a website more sociable and connected with integrations from the hugely popular Facebook website.,javascript,1519167600000,1611993600000,no,http://developers.facebook.com/,
167,Zendesk,,"Organize, prioritize and engage with others on support requests.",mx,1518735600000,1537138800000,yes,http://www.zendesk.com/,
168,Hotjar,"['Audience Measurement', 'Conversion Optimization', 'Feedback Forms and Surveys']","A heatmap, survey, feedback and funnel application.",analytics,1519563600000,1636268400000,yes,http://hotjar.com,
169,CDN JS,,CloudFlare's CDN with popular javascript frameworks available.,cdn,1519563600000,1636444800000,no,http://cdnjs.com,
170,Yahoo User Interface,['JavaScript Library'],"The Yahoo! User Interface (YUI) Library is a set of utilities and controls, written in JavaScript, for building richly interactive web applications using techniques such as DOM scripting, DHTML and AJAX.",javascript,1519563600000,1628146800000,no,http://developer.yahoo.com/yui/,
171,Inspectlet,['Audience Measurement'],Record and watch everything your visitors do.,analytics,1521586800000,1555023600000,maybe,http://www.inspectlet.com/,
172,HTML5 History API,,A standardized way to manipulate the browser history via script.,javascript,1526252400000,1628146800000,no,http://www.whatwg.org/specs/web-apps/current-work/multipage/history.html,
173,Global Site Tag,,"Google's primary tag for Google Measurement/Conversion Tracking, Adwords and DoubleClick.",analytics,1526252400000,1635058800000,no,https://support.google.com/adwords/answer/7548399,
174,IPhone / Mobile Compatible,,The website contains code that allows the page to support IPhone / Mobile Content.,mobile,1526338800000,1636444800000,no,http://apple.com,
175,reCAPTCHA,['CAPTCHA'],Anti-bot CAPTCHA widget from Google.,widgets,1531177200000,1636444800000,no,https://www.google.com/recaptcha/intro/index.html,
176,Facebook Conversion Tracking,['Conversion Optimization'],"Conversion tracking functionality from Facebook, allows a user to track advertisement clicks.",analytics,1532991600000,1611993600000,no,http://www.facebook.com/help/?page=994,
177,Yieldlab CMP System,,IAB digital advertising consent integration by Yieldlab.,widgets,1534374000000,1534374000000,no,https://yieldlab.de,GDPR Consent Management Platform
178,Adobe Enterprise Cloud,,Emails on this domain can create Adobe Enterprise Cloud accounts.,framework,1536620400000,1537225200000,yes,https://www.adobe.com/au/enterprise.html,
179,Office 365 Mail,['Business Email Hosting'],Email sent from this domain has records showing Office 365 usage.,mx,1537225200000,1636444800000,no,https://products.office.com/en-us/business/office,
180,Microsoft Exchange Online,['Business Email Hosting'],A rich hosted Exchange environment for every user without having to manage a server.,mx,1537225200000,1636444800000,no,http://www.microsoft.com/exchange/en-us/exchange-online-hosted-email.aspx,
181,Microsoft Azure DNS,,This domain is verified with Microsoft Azure.,mx,1537743600000,1636444800000,no,http://windowsazure.com,
182,GlobalSign Domain Verification,,Domain verification for SSL certificate validation.,framework,1538694000000,1636444800000,no,https://support.globalsign.com/customer/portal/articles/2167245-performing-domain-verification---dns-txt-record,
183,Facebook Domain Verification,,Domain Verification provides a way for you to claim ownership of your domain in Facebook Business Manager.,framework,1538953200000,1636444800000,no,https://developers.facebook.com/docs/sharing/domain-verification/,
184,Net Atlantic,['Marketing Platform'],Email Marketing Solutions & Services,mx,1541286000000,1543273200000,yes,https://www.netatlantic.com/,
185,Snap Pixel,,"With the Snap Pixel, advertisers can track their customers journey. Snapchat Ads.",ads,1552863600000,1589842800000,no,https://forbusiness.snapchat.com/measurement/,
186,Yahoo Dot,,Fives advertisers a simple way to measure and improve customer engagement across campaigns.,analytics,1552863600000,1592002800000,no,https://advertising.yahoo.com/Blog/DOT-RELEASE.html,
187,SkimLinks,['Contextual Advertising'],"A content-to-commerce platform for publishers to attempt to monetize their content through automatic affiliation of product links, and sharing the resulting shopping-intent data with marketers.",ads,1552863600000,1589842800000,no,http://skimlinks.com,
188,The Trade Desk,['Demand-side Platform'],Data-driven marketing suite that offers marketers a single place to buy all forms of online media.,ads,1552863600000,1607760000000,no,http://www.thetradedesk.com,
189,Google AdWords Conversion,"['Advertiser Tracking', 'Conversion Tracking']",Adwords conversion tracking code.,analytics,1559430000000,1636268400000,no,https://support.google.com/adwords/answer/6095821#get_tag,Google Conversion Tracking
190,Google Conversion Linker,,Detects the ad click information in your conversion page URLs and stores this information to associate an ad click with a conversion.,analytics,1559430000000,1636268400000,no,https://support.google.com/tagmanager/answer/7549390?hl=en,
191,Tealium,"['Tag Management', 'Customer Data Platform']",Tealium is a tag management system that helps organizations manage any combination of web analytics and digital marketing tags.,widgets,1560985200000,1636182000000,yes,http://www.tealium.com/,
192,Tealium UTAG,,Tealium data layer tag.,analytics,1561330800000,1607760000000,no,http://tealium.com,Tealium
193,Amazon API Gateway,,"Create, publish, maintain, monitor, and secure APIs at any scale.",framework,1562281200000,1636358400000,no,https://aws.amazon.com/api-gateway/,
194,Google Floodlight Counter,,The Floodlight Counter tag allows you to count the number of times someone visits your site after clicking on an advertisement for it.,ads,1562281200000,1636268400000,no,https://support.google.com/tagmanager/answer/6107168?hl=en,
195,Twitter Website Universal Tag,,A tool from Twitter that makes it possible for advertisers to track website conversions and manage tailored audience campaigns.,analytics,1567119600000,1587337200000,no,https://blog.twitter.com/2016/website-conversion-tracking-and-remarketing-made-easier-and-more-flexible,
196,Twitter Conversion Tracking,"['Conversion Optimization', 'Conversion Tracking']",Twitter ads conversion tracking code.,analytics,1567119600000,1592002800000,no,https://business.twitter.com/en/help/campaign-measurement-and-analytics/conversion-tracking-for-websites.html,
197,Twitter Analytics,['Conversion Optimization'],A tool that helps website owners understand how much traffic they receive from Twitter and the effectiveness of Twitter integrations on their sites. Includes Twitter Conversion Tracking.,analytics,1567119600000,1592002800000,no,https://dev.twitter.com/blog/introducing-twitter-web-analytics,
198,Organization Schema,['Schema'],"Organization i.e. school, NGO, Corporation.",framework,1569711600000,1635058800000,no,https://schema.org/Organization,
199,PostalAddress Schema,['Schema'],A mailing address.,framework,1569711600000,1635058800000,no,https://schema.org/PostalAddress,
200,Yahoo Image CDN,,The website contains links to Yahoo image CDN.,cdn,1570921200000,1589842800000,no,http://yahoo.com,
201,Yahoo Web Analytics,['Audience Measurement'],Yahoo! Web Analytics is an enterprise site analytics tool that provides real-time insight into visitor behavior on your website.,analytics,1570921200000,1607760000000,no,http://web.analytics.yahoo.com,
202,Google Analytics Ecommerce,,Collect eCommerce data with Google Analytics.,analytics,1576450800000,1592002800000,no,https://developers.google.com/analytics/devguides/collection/analyticsjs/ecommerce,Google Analytics
203,Google Floodlight Sales,,Implementation of the Google Floodlight Sales Google Marketing Platform system.,ads,1579647600000,1636268400000,no,https://support.google.com/dcm/answer/2823388?visit_id=636940009201696642-2210473010&rd=1,
204,UNPKG,,"unpkg is a fast, global content delivery network for everything on npm.",cdn,1584140400000,1628146800000,no,https://unpkg.com,
205,Axios,,Promise based HTTP client for the browser and node.js,javascript,1584140400000,1628146800000,no,https://github.com/mzabriskie/axios,
206,COVID-19,,This website mentions COVID-19 / Novel Coronavirus.,widgets,1584140400000,1624518000000,no,https://www.who.int/emergencies/diseases/novel-coronavirus-2019,
207,Outbrain,['Content Curation'],Outbrain provides content engagement by linking to other articles.,ads,1585263600000,1589842800000,no,http://outbrain.com,
208,WebEx Panel,,WebEx system.,widgets,1585263600000,1592262000000,no,http://webex.com,
209,es6 promise,,A polyfill for ES6-style Promises.,javascript,1588201200000,1636268400000,no,https://github.com/stefanpenner/es6-promise,
210,DMARC,['DMARC'],A technical specification created by a group of organizations that want to help reduce the potential for email-based abuse,mx,1588287600000,1636268400000,no,http://www.dmarc.org,
211,PerimeterX,,Bot protection services.,widgets,1588978800000,1636444800000,yes,https://www.perimeterx.com/,
212,Cloudflare,,Automatically optimizes the delivery of your web pages so your visitors get the fastest page load times and best performance.,cdn,1598482800000,1636182000000,no,http://www.cloudflare.com/,
213,Cloudflare JS,,Loads content from Cloudflare CDN.,cdn,1598770800000,1636444800000,no,https://cloudflare.com,
214,Fastly Verified CDN,,Content hosted by Fastly.,cdns,1604995200000,1611043200000,maybe,http://fastly.com,
215,Advertising.com,"['Ad Analytics', 'Ad Exchange', 'Ad Network']","Ad.com network reaches nearly 85% of all Internet users in the U.S., making us the biggest ad network in town - from Verizon Media.",ads,1607760000000,1607760000000,no,http://advertising.com,
216,HappyFox,['Ticketing System'],Online help desk software and a web based support ticket system.,cms,1607986800000,1636444800000,yes,https://www.happyfox.com,
217,LetsEncrypt,['Root Authority'],Let’s Encrypt is a free open Certificate Authority.,ssl,1611561600000,1636444800000,no,https://letsencrypt.org,
218,Fastly Load Balancer,,Hosted on Fastly's Load Balancing system.,hosting,1615503600000,1636444800000,no,https://www.fastly.com/,
219,Google Optimize 360,"['A/B Testing', 'Personalization']",Test different variations of a website and then tailor it to deliver a personalized experience that works best for each customer and for your business.,analytics,1616828400000,1636444800000,maybe,https://www.google.com/analytics/optimize/,
220,My Salesforce,,This business has a Salesforce login page.,cms,1628060400000,1636268400000,yes,https://salesforce.com,
221,Popper.js,,A library to manage your pop ups.,javascript,1627714800000,1636444800000,no,https://popper.js.org/,
222,Slick JS,['Animation'],Fully responsive carousel library.,javascript,1627714800000,1636444800000,no,http://kenwheeler.github.io/slick,
223,jQuery 3.5.1,,jQuery version 3.5.1,javascript,1627714800000,1629615600000,no,https://blog.jquery.com/2020/05/04/jquery-3-5-1-released-fixing-a-regression/,jQuery
224,jQuery Easing,"['Animation', 'jQuery Plugin']","A jQuery extension that provides functionality to ""ease"" things onto or off of the screen.",javascript,1627714800000,1636444800000,no,http://gsgd.co.uk/sandbox/jquery/easing/,jQuery
225,Mobile Non Scaleable Content,,"This content is formatted for mobile devices, it does not allow the content to be scaled.",mobile,1627714800000,1636444800000,no,http://developer.apple.com/library/safari/#documentation/appleapplications/reference/SafariHTMLRef/Articles/MetaTags.html,
226,Nginx 1.14,,Nginx version 1.14.*,Web Server,1628060400000,1628233200000,no,http://nginx.org/en/CHANGES-1.14,nginx
227,Ubuntu,,"Ubuntu is a free, Debian derived Linux-based operating system, available with both community and professional support.",Server,1628060400000,1628233200000,no,http://ubuntu.com,
228,jQuery 3.6.0,,jQuery version 3.6.0,javascript,1627714800000,1636444800000,no,https://blog.jquery.com/2021/03/02/jquery-3-6-0-released/,jQuery
229,Slick,,Standalone CSS Selector Parser and Engine from MooTools.,javascript,1627887600000,1633158000000,no,https://github.com/mootools/slick,
