,Name,Categories,Description,Tag,FirstDetected,LastDetected,IsPremium,Link,Parent
0,Google Analytics with Ad Tracking,['Advertiser Tracking'],"Google Analytics collects the information it normally does, as well as the DoubleClick cookie when that cookie is present in relation to display advertising tracking.",analytics,1387494000000,1627714800000,no,https://support.google.com/analytics/answer/2444872,
1,Dotomi,,"Dotomi applies Personalized Media practices to anonymous, user-level marketing programs.",analytics,1386889200000,1423180800000,no,http://www.dotomi.com/,
2,Rocket Fuel,,Unlocks the power of artificial intelligence to make digital advertising better,ads,1386889200000,1589842800000,no,http://rocketfuel.com/,
3,WordPress 3.3,,WordPress version 3.3.*,cms,1385679600000,1440370800000,no,http://codex.wordpress.org/Version_3.3,WordPress
4,Conversant,,Scalable solutions for advertisers to cost-effectively acquire customers and for publishers to maximize their revenue. ,ads,1380841200000,1423180800000,no,http://fastclick.net,
5,BrightRoll,['Ad Network'],Enabling agencies and brand advertisers to execute smart video ad campaigns across the industry’s leading publishers.,ads,1380236400000,1453852800000,no,http://www.brightroll.com/,
6,Adap.TV,,Video monetization service.,ads,1380236400000,1451088000000,no,http://adap.tv,
7,Datalogix,"['Advertiser Tracking', 'Conversion Optimization']",Leverages the power of purchase-based audience targeting to drive measurable online and offline sales,analytics,1379631600000,1462143600000,no,http://datalogix.com,
8,eXelate,,The first and largest open marketplace for behavioral targeting data.,ads,1379631600000,1453852800000,no,http://www.exelate.com,
9,Facebook Exchange FBX,['Ad Exchange'],Facebook Exchange (FBX) is a real-time bidded ad serving protocol.,ads,1379631600000,1451088000000,no,https://developers.facebook.com/docs/reference/ads-api/rtb/,
10,AppNexus,"['Ad Exchange', 'Demand-side Platform']","Provides access to the major exchanges and aggregators, as well as cloud infrastructure scalable to billions of ad impressions a day with a layer of real-time decisioning on top.",ads,1379631600000,1607760000000,no,http://www.appnexus.com/,
11,Neustar AdAdvisor,,Neustar AdAdvisor provides data to online marketers and websites to help them improve their ability to deliver content and advertising to consumers.,ads,1379631600000,1468450800000,no,http://www.adadvisor.net/,
12,Openads/OpenX,['Ad Server'],"Openads offer ad serving software that is simple, reliable and totally independent. Best of all, it's free!",ads,1379631600000,1453852800000,no,http://openads.org,
13,Tube Mogul,,"TubeMogul is a free service that provides a single point for deploying uploads to the top video sharing sites, and powerful analytics on who, what, and how videos are being viewed.
",media,1379631600000,1477522800000,no,http://tubemogul.com,
14,Turn,"['Ad Analytics', 'Audience Targeting', 'Data Management Platform', 'Demand-side Platform', 'Multi-Channel', 'Ad Network', 'Digital Video Ads']","Provides performance-based CPA, CPC, and CPM pricing, automatic and blended targeting, plus market quality control through Smart Marketing technology. Now known as Amobee.",ads,1379631600000,1380841200000,no,http://turn.com,
15,Rapleaf,['Marketing Automation'],Marketing automation tools with the necessary data to help brands keep their customers engaged. Now TowerData.,analytics,1379631600000,1589842800000,yes,http://www.rapleaf.com,
16,Rubicon Project,,Advertising optimization service.,ads,1379631600000,1510182000000,no,http://rubiconproject.com,
17,Masked Input,['jQuery Plugin'],Allows a user to more easily enter fixed width input.,javascript,1379631600000,1636444800000,no,http://digitalbush.com/projects/masked-input-plugin/,
18,Yield Manager,,Right Media owned by Yahoo. Operates one of the world's largest digital advertising exchanges.,ads,1379631600000,1440460800000,no,http://yieldmanager.com,
19,Blue Lithium,['Ad Network'],BlueLithium is the data driven performance marketing company.,ads,1379631600000,1423180800000,no,http://bluelithium.com,
20,AdMeld,,"AdMeld is an advertising network which claims to maximize revenue from their ad inventory, eliminate unwanted ads and reduce operating costs.",ads,1379631600000,1383865200000,no,http://www.admeld.com/,
21,FitVids.JS,['jQuery Plugin'],"A lightweight, easy-to-use jQuery plugin for fluid width video embeds.",javascript,1379631600000,1440370800000,no,http://fitvidsjs.com/,
22,Acxiom,['Advertiser Tracking'],Technology and marketing services that enable marketers to manage audiences.,analytics,1379631600000,1427068800000,no,http://acxiom.com/,
23,GStatic Google Static Content,,Google has off-loaded static content (Javascript/Images/CSS) to a different domain name in an effort to reduce bandwidth usage and increase network performance for the end user.,cdn,1379631600000,1635058800000,no,https://google.com,
24,AOL-Time Warner Online Advertising,,The website uses AOL-Time Warner Advertising Network,ads,1379631600000,1440460800000,no,http://aol.com,
25,BlueKai,['Ad Exchange'],The BlueKai Data Exchange enables partners to buy and own data to boost ad targeting across any media.,ads,1379631600000,1477522800000,no,http://bluekai.com,
26,DemDex,"['Audience Targeting', 'Multi-Channel']","Demdex's turn-key audience management solutions make implementing a dynamic, multi-channel data strategy cost-effective and easy. Now known as Adobe Audience Manager.",ads,1379631600000,1501282800000,no,http://www.demdex.com/,
27,Yahoo Publisher Network,,Yahoo! Publisher Network offers easy ways to make money online. Publishers of all sizes have access to products and services designed to earn money.,ads,1379631600000,1383865200000,no,http://publisher.yahoo.com,
28,Triggit,"['Demand-side Platform', 'Retargeting / Remarketing']",Real-time digital media bidding platform.,ads,1379631600000,1451088000000,maybe,http://www.triggit.com/,
29,comScore,"['Advertiser Tracking', 'Audience Measurement', 'Conversion Optimization', 'Site Optimization', 'Visitor Count Tracking']",Market research company that studies internet trends and behavior.,analytics,1378422000000,1403740800000,no,http://www.comscore.com,
30,Google Plus One Platform,,Google+ API functionality.,widgets,1378422000000,1627887600000,no,https://developers.google.com/+/,
31,GeoTrust SSL,['Root Authority'],Certificate provided by GeoTrust.,ssl,1372806000000,1555023600000,no,http://geotrust.com,
32,FlexSlider,"['jQuery Plugin', 'Slider']",jQuery Slider toolkit from Woothemes.,javascript,1372806000000,1440370800000,no,http://www.woothemes.com/flexslider,
33,Google Webmaster,,Webmaster tools provide you with a free and easy way to make your site more Google-friendly.,Web Master,1359637200000,1635058800000,no,http://www.google.com/webmasters/,
34,Yoast Plugins,['WordPress Plugins'],SEO based plugins from Yoast.,widgets,1343570400000,1482879600000,no,http://yoast.com/wordpress/seo/,
35,RSS,,"A family of web feed formats used to publish frequently updated content such as blog entries, news headlines or podcasts.",feeds,1343570400000,1628146800000,no,http://en.wikipedia.org/wiki/RSS_(file_format),
36,Wordpress Plugins,,Plugins are tools to extend the functionality of WordPress. The website uses various plugins from WordPress to provide additional functionality. Some of them may be listed here.,widgets,1343570400000,1482879600000,no,http://codex.wordpress.org/Plugins,
37,WordPress,"['Open Source', 'Blog']","WordPress is a state-of-the-art semantic personal publishing platform with a focus on aesthetics, web standards, and usability.",cms,1343570400000,1482879600000,no,http://wordpress.org,
38,Modernizr,['Compatibility'],Modernizr allows you to target specific browser functionality in your stylesheet.,javascript,1343570400000,1627714800000,no,http://www.modernizr.com,
39,Really Simple Discovery,,"Really Simple Discovery is a way to help client software find the services needed to read, edit, or ""work with"" weblogging software.",feeds,1343570400000,1454972400000,no,http://cyber.law.harvard.edu/blogs/gems/tech/rsd.html,
40,Live Writer Support,,Windows Live Writer Tagging Support Schema,feeds,1343570400000,1454972400000,no,http://windowslivewriter.spaces.live.com,
41,Pingback Support,,"A Pingback is one of three types of Linkbacks, methods for Web authors to request notification when somebody links to one of their documents.",feeds,1343570400000,1482879600000,no,http://en.wikipedia.org/wiki/Pingback,
42,Gravity Forms,['Feedback Forms and Surveys'],Contact Forms for WordPress.,widgets,1343570400000,1440370800000,yes,http://www.gravityforms.com/,
43,Google Maps,['Maps'],Google maps embedded into the webpage.,mapping,1343570400000,1636182000000,no,http://www.google.com/apis/maps/,
44,Nivo Slider,['Slider'],A polished JQuery Slider plugin.,javascript,1343916000000,1440370800000,no,http://nivo.dev7studios.com/,
45,Google Adsense,['Contextual Advertising'],A contextual advertising solution for delivering Google AdWords ads that are relevant to site content pages.,ads,1343570400000,1504479600000,no,http://google.com/adsense,
46,Google Conversion Tracking,"['Conversion Optimization', 'Conversion Tracking']","This free tool in AdWords can show you what happens after customers click your ad (for example, whether they purchased your product, called from a mobile phone or downloaded your app).",analytics,1343570400000,1627714800000,no,https://support.google.com/adwords/answer/1722054,
47,Apache,,Apache has been the most popular web server on the Internet since April 1996.,Web Server,1324213200000,1482879600000,no,http://httpd.apache.org/,
48,IgnitionOne,['Conversion Optimization'],IgnitionOne's Digital Marketing Suite includes the most essential technologies you need to improve online revenue within a single interface. Formally SearchIgnite.,analytics,1336744800000,1341496800000,yes,http://www.ignitionone.com/,
49,Lotame Crowd Control,,Data driven marketing advertising program provides social media sites with advance targeting,analytics,1333634400000,1589842800000,no,http://lotame.com,
50,Netmining,['Marketing Automation'],Performance marketing services.,analytics,1333634400000,1380236400000,yes,http://www.netmining.com/,
51,Facebook SDK,," JavaScript SDK enables you to access all of the features of the Graph API via JavaScript, and it provides a rich set of client-side functionality for authentication and sharing. It differs from Facebook Connect.",javascript,1330779600000,1633158000000,no,http://developers.facebook.com/docs/reference/javascript/,
52,Twitter Follow Button,,Follow Button to your website to increase engagement and create a lasting connection with your audience.,widgets,1330779600000,1524610800000,no,https://twitter.com/about/resources/buttons#follow,
53,Twitter Platform,,The page embeds the Twitter platform in one method or another.,javascript,1330779600000,1628146800000,no,http://twitter.com/about/resources,
54,Facebook Like Box,,The use of a fan page Like box Facebook page integration.,widgets,1330779600000,1341496800000,no,http://developers.facebook.com/docs/reference/plugins/like-box,
55,ShareThis,"['Bookmarking', 'Social Sharing']","One button sharing - quick sharing to MySpace, Email and more!",widgets,1320584400000,1403740800000,no,http://sharethis.com,
56,Facebook Like,['Social Sharing'],"Allows users to Like items they find on the web, similar to how you Like items within Facebook.",widgets,1317560400000,1524610800000,no,http://developers.facebook.com/docs/reference/plugins/like,
57,IIS 6,,Internet-based service for servers using Microsoft Windows. It is the world's second most popular web server in terms of overall websites.,Web Server,1317560400000,1381705200000,no,http://www.iis.net,IIS
58,Visual Studio,,Content of the page was generated using Microsoft Visual Studio .,framework,1312120800000,1381705200000,no,http://msdn.microsoft.com/vstudio/,
59,Visual Basic .NET,,This page has a meta content tag indicating it was built using Visual Basic .NET,cms,1312120800000,1381705200000,no,http://msdn.microsoft.com/en-us/vbasic/default.aspx,
60,AddThis,"['Social Sharing', 'Bookmarking']",Widgets that allow visitors to save and promote the site.,widgets,1312120800000,1589842800000,no,http://addthis.com,
61,Kimbia Donation Widget,,Fundraising widget - now GiveGab.,widgets,1299070800000,1409443200000,no,http://longcenter.kimbia.com,
62,Dublin Core,,The website contains dublin core meta data extensions.,feeds,1294059600000,1325854800000,no,http://dublincore.org,
63,AJAX Libraries API,,"The AJAX Libraries API is a content distribution network and loading architecture for the most popular, open source JavaScript libraries.",cdn,1294059600000,1409443200000,no,http://code.google.com/apis/ajaxlibs/documentation/,
64,jQuery,['JavaScript Library'],"JQuery is a fast, concise, JavaScript Library that simplifies how you traverse HTML documents, handle events, perform animations, and add Ajax interactions to your web pages. jQuery is designed to change the way that you write JavaScript.",javascript,1294059600000,1636444800000,no,http://jquery.com,jQuery
65,jQuery Dimensions,,"Extends jQuery to provide dimension-centric methods for getting widths, heights, offsets and more.",javascript,1294059600000,1325854800000,no,http://plugins.jquery.com/project/dimensions,jQuery
66,SWFObject,,SWFObject is a small Javascript file used for embedding Adobe Flash content. The script can detect the Flash plug-in in all major web browsers (on Mac and PC) and is designed to make embedding Flash movies as easy as possible.,javascript,1294059600000,1325854800000,no,http://blog.deconcept.com/swfobject/,
67,jQuery BlockUI,,"jQuery BlockUI Plugin lets you simulate synchronous behavior when using AJAX, without locking the browser.",javascript,1294059600000,1325854800000,no,http://jquery.malsup.com/block/,jQuery
68,Akamai,,Akamai provides a distributed computing platform for global Internet content and application delivery.,cdn,1294059600000,1464303600000,no,http://akamai.com,
69,Eloqua,['Marketing Automation'],Marketing automation provider.,analytics,1294059600000,1325854800000,yes,http://www.eloqua.com/,
70,DoubleClick Floodlight,,Floodlight is feature of DoubleClick ads that allows advertisers to capture and report on the actions of users who visit their website after viewing or clicking on one of the advertiser's ads.,analytics,1294059600000,1607760000000,no,http://www.google.com/support/dfa/partner/bin/static.py?page=guide.cs&guide=28818,
71,DoubleClick.Net,,"DoubleClick enables agencies, marketers and publishers to work together successfully and profit from their digital marketing investments.",ads,1294059600000,1636268400000,no,http://www.doubleclick.com,
72,Google Adsense for Search,,Adding the Google search box to your website puts our search engine at your visitors' fingertips. And combining search with AdSense puts Google's base of advertisers to work for your bottom line.,ads,1294059600000,1325854800000,no,http://www.google.com/adsense/ws-overview,Google Adsense
73,Content Delivery Network,,This page contains links that give the impression that some of the site contents are stored on a content delivery network.,CDN,1294059600000,1636444800000,no,http://en.wikipedia.org/wiki/Content_Delivery_Network,
74,Social Twist,,Widgets by Social Twist provide word of mouth marketing.,widgets,1294059600000,1325854800000,no,http://socialtwist.com,
75,Google Analytics,"['Application Performance', 'Audience Measurement', 'Visitor Count Tracking']",Google Analytics offers a host of compelling features and benefits for everyone from senior executives and advertising and marketing professionals to site owners and content developers.,analytics,1294059600000,1636268400000,no,http://google.com/analytics,
76,Tynt Tracer,,"Tynt Tracer, monitors and watches what is being copied from your website, such as your copyrighted content.",analytics,1294059600000,1325854800000,no,http://tynt.com,
77,Shadowbox,,Shadowbox is an online media viewer application that supports all of the web's most popular media publishing formats. ,javascript,1294059600000,1325854800000,no,http://www.shadowbox-js.com,
78,MBuy,,Media Buying system across all digital channels.,ads,1294059600000,1325854800000,no,http://www.mbuy.com/,
79,PHP,,PHP is a widely used general-purpose scripting language that is especially suited for Web development and can be embedded into HTML.,framework,1294059600000,1608278400000,no,http://www.php.net,
80,IIS,,This website is running on a Microsoft IIS Server solution.,Web Server,1294059600000,1488582000000,no,http://www.microsoft.com/servers/home.mspx,
81,IIS 7,,Internet-based services for servers using Microsoft Windows.,Web Server,1294059600000,1488582000000,no,http://www.iis.net,IIS
82,ASP.NET,,"ASP.NET is a web application framework marketed by Microsoft that programmers can use to build dynamic web sites, web applications and XML web services. It is part of Microsoft's .NET platform and is the successor to Microsoft's Active Server Pages (ASP) technology.",framework,1294059600000,1488582000000,no,http://www.asp.net,
83,Amazon Route 53,['Enterprise DNS'],Amazon's scalable DNS web service system.,ns,1389481200000,1636444800000,no,http://aws.amazon.com/route53/,
84,Google Font API,['Fonts'],The Google Font API helps you add web fonts to any web page.,widgets,1390518000000,1630566000000,no,https://fonts.google.com,
85,Google Universal Analytics,,"The analytics.js JavaScript snippet is a new way to measure how users interact with your website. It is similar to the previous Google tracking code, ga.js, but offers more flexibility for developers to customize their implementations.",analytics,1390518000000,1635058800000,no,https://developers.google.com/analytics/devguides/collection/analyticsjs/,Google Analytics
86,matchMedia,['Compatibility'],matchMedia polyfill for testing media queries in JS.,javascript,1390518000000,1410994800000,no,http://github.com/paulirish/matchMedia.js/,
87,Google Remarketing,['Retargeting / Remarketing'],Google code specifically for remarketing/retargeting based advertising.,ads,1395270000000,1636268400000,no,http://www.google.com.au/ads/innovations/remarketing.html,
88,SPF,,The Sender Policy Framework is an open standard specifying a technical method to prevent sender address forgery.,mx,1397084400000,1636444800000,no,http://www.openspf.org/,
89,Facebook Like Button,,The code to implement a Facebook Like Button on the page.,widgets,1397862000000,1524610800000,no,http://developers.facebook.com/docs/reference/plugins/like/,
90,Yoast WordPress SEO Plugin,['WordPress Plugins'],"Functionality that helps you optimize your pages content, images titles, meta descriptions and more.",widgets,1405551600000,1482879600000,no,https://yoast.com/wordpress/plugins/seo/,Yoast Plugins
91,Amazon Virginia Region,['US hosting'],Amazon Hosted EC2 Instances in Virginia,hosting,1409785200000,1636182000000,no,http://aws.amazon.com,Amazon
92,Postmark,['Transactional Email'],Email delivery for web apps.,mx,1410390000000,1636444800000,yes,http://postmarkapp.com,
93,Facebook Domain Insights,['Social Management'],This website contains tracking information that allows admins to see Facebook Insights out of Facebook to this domain.,analytics,1411171200000,1636444800000,no,http://www.facebook.com/insights/,
94,New Relic,['Application Performance'],New Relic is a dashboard used to keep an eye on application health and availability while monitoring real user experience.,analytics,1411171200000,1636444800000,no,http://newrelic.com/,
95,Pingdom RUM,['Application Performance'],Real User Monitoring gives insight into performance for actual users visiting the website.,analytics,1411171200000,1514674800000,yes,https://www.pingdom.com/rum/,
96,Google Plus Embedded Posts,,Embed Google+ pages into any webpage.,widgets,1411171200000,1462489200000,no,http://developers.google.com/+/web/embedded-post/,
97,Django CSRF,,"Django is a high-level Python Web framework that encourages rapid development and clean, pragmatic design. This metric displays sites that are using Django + CSRF.",framework,1411171200000,1635058800000,no,http://www.djangoproject.com/,
98,Quantcast Measurement,"['Audience Measurement', 'Mobile']",Provides Quantcast with tracking information about your site which anyone can access and view demographic information.,analytics,1411171200000,1501282800000,no,http://www.quantcast.com,
99,nginx,,nginx [engine x] is a HTTP server and mail proxy server written by Igor Sysoev.,Web Server,1411171200000,1635058800000,no,http://nginx.net/,
100,YouTube,"['Live Stream / Webcast', 'Online Video Platform', 'Social Video Platform']",Embedded videos from YouTube.,media,1411171200000,1636444800000,no,http://youtube.com,
101,jQuery Validate,['jQuery Plugin'],JQuery Form Validation Plugin.,javascript,1411171200000,1636444800000,no,http://jqueryvalidation.org,jQuery
102,Google API,,The website uses some form of Google APIs to provide interaction with the many API's Google Providers.,javascript,1411171200000,1628146800000,no,http://code.google.com,
103,CloudFront,,"Amazon CloudFront is a web service for content delivery. It integrates with other Amazon Web Services to give developers and businesses an easy way to distribute content to end users with low latency, high data transfer speeds, and no commitments.",cdn,1411171200000,1636182000000,no,http://aws.amazon.com/cloudfront/,
104,Google Maps API,,Google Maps has a wide array of APIs that let you embed the functionality of Google Maps.,mapping,1411171200000,1636182000000,no,https://developers.google.com/maps/,
105,Typekit,,Typekit is the easiest way to use real fonts on the web. It's a subscription-based service for linking to high-quality Open Type fonts from some of the world's best type foundries.,widgets,1411171200000,1628146800000,no,http://typekit.com,
106,GeoTrust EV,"['Extended Validation', 'Root Authority']",EV Certificate form GeoTrust,ssl,1411171200000,1423180800000,yes,http://geotrust.com,GeoTrust SSL
107,Pinterest,,Content from the social image sharing website Pinterest.,widgets,1411171200000,1635058800000,no,http://pinterest.com,
108,SeeWhy,['Cart Abandonment'],"A way to convert abandoned shopping carts and 
online forms into revenue by following up on abandoned carts,",analytics,1411171200000,1462143600000,yes,http://www.seewhy.com/,
109,Facebook Custom Audiences,['Retargeting / Remarketing'],Custom Audiences from your website makes it possible to reach people who visit your website and deliver the right message to them on Facebook.,ads,1411171200000,1611993600000,no,https://developers.facebook.com/docs/reference/ads-api/custom-audience-website,
110,Collective Media,,"Collective Media deliver online audiences through brand-safe, premium inventory. Purchased Tumri.",ads,1412204400000,1495926000000,no,http://www.collective.com/,
111,SSL by Default,,The website redirects traffic to an HTTPS/SSL version by default.,ssl,1412809200000,1636268400000,no,http://trends.builtwith.com/ssl,
112,Viewport Meta,,This page uses the viewport meta tag which means the content may be optimized for mobile content.,mobile,1413331200000,1636444800000,no,https://developers.google.com/speed/docs/insights/ConfigureViewport,
113,JBoss,,JBoss is a open-source Java based application server.,Web Server,1414018800000,1414018800000,no,http://jboss.org,
114,jQuery UI,"['jQuery Plugin', 'UI']","jQuery UI provides abstractions for low-level interaction and animation, advanced effects and high-level, themeable widgets, built on top of the jQuery JavaScript Library, that you can use to build highly interactive web applications.",javascript,1416438000000,1636444800000,no,http://jqueryui.com/,jQuery
115,jQuery CDN,,The jQuery Amazon S3 Content Delivery Network,cdn,1416438000000,1636444800000,no,http://blog.jquery.com/2008/11/19/cloudfront-cdn-for-jquery/,
116,Facebook Tag API,"['Audience Measurement', 'Conversion Optimization']",The Javascript Tag API can be used to track custom audience and conversion events.,analytics,1425340800000,1462143600000,no,https://developers.facebook.com/docs/ads-for-websites/tag-api,
117,Facebook CDN,,This page has content that links to the Facebook content delivery network.,cdn,1442188800000,1517922000000,no,http://www.facebook.com,
118,Twitter Ads,"['Ad Network', 'Retargeting / Remarketing']",Twitter advertising includes conversion tracking and re-marketing tools.,ads,1442188800000,1587337200000,no,http://ads.twitter.com,
119,Shutterstock,['Image Provider'],Images on this website may have been sourced from Shutterstock.,widgets,1443049200000,1592780400000,no,http://shutterstock.com,
120,Adobe Target Standard,['A/B Testing'],Digital marketing and A/B testing product from Adobe and a part of the Adobe Marketing Cloud.,analytics,1451088000000,1501282800000,yes,http://www.adobe-target.com/,Omniture Adobe Test and Target
121,Omniture SiteCatalyst,['Marketing Automation'],"Omniture SiteCatalyst provides your website with actionable, real-time intelligence regarding online strategies and marketing initiatives.",analytics,1451088000000,1501282800000,yes,http://www.omniture.com/,
122,Omniture Adobe Test and Target,"['A/B Testing', 'Audience Measurement', 'Conversion Optimization', 'Marketing Automation', 'Personalization', 'Product Recommendations']","Test&Target - Adobe Target Advanced, gives marketers the necessary capabilities to continually make their online content and offers more relevant to their customers-yielding greater conversion.",analytics,1451088000000,1501282800000,yes,http://www.omniture.com/en/products/conversion/testandtarget,
123,WURFL js,['Compatibility'],WURFL.js is a JavaScript file that provides information about the device that is accesing your page.  Now known as wurfl.io,javascript,1452640829362,1558566000000,no,http://wurfljs.com/,
124,LiveRail,['Digital Video Ads'],Online video advertising,ads,1453766400000,1453852800000,no,http://liverail.com/,
